2017-10-29 18:40:32,from 1v9'ing like he has for the entire tournament. If Crown can do that, he redeems himself. If he gets solo killed again, SKT wins,neg
2017-10-29 18:40:09,The storyline for this finals is so good. SKT looks mortal, SSG looks >= in every lane except mid. Crown's redemption is to prevent Faker,neg
2017-10-29 18:37:20,matches. Like Samsung is the team that looks really strong. Lets not act like they came in and wiped the floor with teams like SKT and KOO,pos
2017-10-29 18:36:38,i don't know how people are annoyed at this Yea it can be predictable, but this has been such a fun ride with SKT looking beat in both,neg
2017-10-29 18:36:33,It’s relation not causation. It’s because the only teams to win in the last 5 years has been Samsung or SKT .,neg
2017-10-29 18:36:33,Just finished watching semis of #Worlds2017 sigh. SKT will have a 4th skin. #SKTGalio,neg
2017-10-29 18:31:51,Not so much Koreans it's just lame and boring to see skt again. Like if others got there sure but they didn't.,neg
2017-10-29 18:30:01,ICYMI: Samsung Galaxy defeat Team WE to set up a rematch with SKT in the #Worlds2017 finals: https:// dotesports.com/league-of-lege nds/we-ssg-semi-worlds-recap-18325 … #SummonYourStrength pic.twitter.com/E4HkQae49W,pos
2017-10-29 18:28:02,I would agree if it was any team other than SKT .,neg
2017-10-29 18:27:03,If you're going to say you like good players with personalities and leave out @SKT _Huni , Wolf, Ambition, and Crown then idk what to say,neg
2017-10-29 18:23:13,You mean basically every SKT game? Faker is literally dragging his team over the finish line every game.,neg
2017-10-29 18:19:24,Goddamn it really pushing that SKT win,neg
2017-10-29 18:17:43,I present 1/3 of an acoustic cover (more of an attempt) of the League of Legends Worlds 2017 theme. RIP NA. SKT ... http:// fb.me/zMcROUVO,neg
2017-10-29 18:16:06,I fucking love how much you love skt — omg yea for sure such HUGE FAN was there before fak... https:// curiouscat.me/hugosucksass/p ost/226158001?t=1509311766 …,pos
2017-10-29 18:14:59,hahahahahhha,neg
2017-10-29 18:12:22,LMAO https://www. youtube.com/watch?v=3CsaES xLkvc … @SKT _Wolf You are the best XD,pos
2017-10-29 18:11:19,3) SKT will win again,neg
2017-10-29 18:11:03,SKT T1 LeBlanc by cal pic.twitter.com/LXd9SgUUaW,pos
2017-10-29 18:08:06,U dumb???... Season 2 losers coming from losers beat NV twice in grand finals...champs SAME EXACT THING...also have won more than sk or skt,neg
2017-10-29 18:06:39,Cold blooded SKT ..... cold blooded,neg
2017-10-29 18:05:01,Then why are you even commenting lol,neg
2017-10-29 18:04:44,I love seeing SKT continu their winning streak, i think its a pleasure to see them every year and Kkoma is a boss,neg
2017-10-29 18:01:46,No more skt skins pls NotLikeThis,neg
2017-10-29 18:01:13,homa kesp SKT fel LCK 2-0 best of 3, bas wade7 en SKT byksap ay 7ad fe best of 5 y3nee..,pos
2017-10-29 18:00:02,ICYMI: Samsung Galaxy defeat Team WE to set up a rematch with SKT in the #Worlds2017 finals: https:// dotesports.com/league-of-lege nds/we-ssg-semi-worlds-recap-18325 … #SummonYourStrength pic.twitter.com/Pz0bPVGiTv,pos
2017-10-29 17:56:58,Shout out to SKT and SSG for making it to the finals! Who are you rooting for on the grand stage? #lolesports #leagueoflegends,neg
2017-10-29 17:56:39,There are things that are more entertaining but SKT opt into Galio. I mean, it works but I personally would rather watch something else,neg
2017-10-29 17:49:44,I liked a @YouTube video http:// youtu.be/J0ZZB8iIYy4?a RNG x SKT (Mundial 2017 - Semifinal - Jogo 5),pos
2017-10-29 17:48:29,It really is boring though. SKT Galio incoming Same with ryze in season 5, Faker only played that shit and it was boring to watch5.,neg
2017-10-30 20:59:41,Portrait - geovanakelly_ skt @brendawilker working for project skateporelas #photography … https://www. instagram.com/p/Ba5DelKF2Gn/,pos
2017-10-30 20:59:36,RNG vs. SKT | Semifinals Game 5 | 2017 World Championship | Royal Never Give Up vs SK telecom T1 - ...RNG vs. SKT ... pic.twitter.com/P7FFlzzPUC,pos
2017-10-30 20:54:21,What do u know about basketball,neg
2017-10-30 20:42:45,Today I learned to take my time......we'll see yall on the charts.,neg
2017-10-30 20:41:03,Fuck a boss, I'm the boss,neg
2017-10-30 20:40:42,I'm not disputing that people aren't happy with watching SKT again, but people are excited about Samsung. And they'll watch them try win.,neg
2017-10-30 20:38:08,Thanks for killer ass jams my dude, there's a place for the Gaza fam waiting https:// twitter.com/starfoxlaflare /status/925092713145409536 …,pos
2017-10-30 20:36:23,All possibilities, maybe Misfits go on to win the tournament if they get the right engage onto SKT at the middle turret,neg
2017-10-30 20:35:58,Honestly want skt to win again because it'd be pretty funny to win worlds so many times.,neg
2017-10-30 20:22:21,@SuedkurveTO Just a loyal SKT member...topless. #SKTonTour pic.twitter.com/oGNo8DJ86i,pos
2017-10-30 20:20:50,I've beaten SKT at worlds more times than I've been MCM'd,neg
2017-10-30 20:12:49,idk why i’m getting mad i know skt beats rng but can they like stop being like this,neg
2017-10-30 20:11:58,Is it hot that iii sk8 run surf and gym bub,pos
2017-10-30 20:11:19,So many angry ppl about SSG vs SKT . It's even better the second time! There's so many levels of storylines. And it's high level play.,neg
2017-10-30 20:10:01,tranquility,neg
2017-10-30 20:06:32,Even those in Balouchistan had some Indic influence - esp pre-Islamic period: http:// coinindia.com/galleries-para ta-rajas.html … [Also called Paradas in Skt docs],neg
2017-10-30 19:58:59,Love without action is meaningless and action without love is irrelevant. The key to living a happier life,pos
2017-10-30 19:57:07,Next on Buzzfeed: Brushing your teeth is racist,neg
2017-10-30 19:50:09,This Saturday is the final between Samsung and SKT,neg
2017-10-30 19:47:02,Everytime when I think #Buzzfeed can not get dumber I see #nonsense like that,neg
2017-10-30 19:42:16,Fraga? https:// twitter.com/djongbafc/stat us/925130123787030528 …,pos
2017-10-30 19:33:49,Krakow Krakow kkkk,neg
2017-10-30 19:30:55,Can skt win 5 worlds before losing to anyone so i can call faker 5 stars man,neg
2017-10-30 19:29:11,How vast a memory has Love!,neg
2017-10-30 19:21:19,Around the Web: SKT and SSG set for a worlds rematch and Mercedes-Benz at the Dota 2 Major https://www. thescoreesports.com/dota2/news/153 54-around-the-web-skt-and-ssg-set-for-a-worlds-rematch-and-mercedes-benz-at-the-dota-2-major … via @theScoreesports,neg
2017-10-30 19:19:58,It's between this and Alphari's how many times have SKT won UK prem tweet for tweet of the year,neg
2017-10-30 19:16:41,i can’t believe #worlds2017 is gonna be ssg vs. skt again,neg
2017-10-30 19:14:25,Wheres the skt spam??,neg
2017-10-30 19:12:31,Me ha gustado un vídeo de @YouTube ( http:// youtu.be/MMKLi0Kapyk?a - Awesome moments of FAKER, SKT T1 (WOLF, BANG, BENGI, DUKE, BLANK) |,pos
2017-10-30 19:04:06,(see Faker vs. RNG, turnaround teamfight at SKT 's inhib, I think it's still lategame? even if not 6 items) but I guess it's hard to pull off. Fine, don't call them "scaling" to imply that they're weak early, but scaling hard and having early spikes aren't mutually exclusive.,neg
2017-10-30 19:02:46,The BEST of Korea versus China from EVERY LoL World Championship ft. SKT , RNG and SSG (2012 - 2017) https://www. youtube.com/watch?v=jExGVA hh4mc …,pos
2017-10-30 19:01:33,It's gonna be another boring skt win,neg
2017-10-30 18:59:00,Love is the emblem of eternity, it confounds all notion of time, effaces all memory of a beginning, all fear of an end.,neg
2017-10-30 18:55:31,2 people followed me and 3 people unfollowed me // automatically checked by http:// fllwrs.com,neg
2017-10-30 18:54:47,Rishtas Like a business transaction.Must Watch http:// fb.me/1bDdloiQv,neg
2017-10-30 18:48:03,Missed SKT Huni's death defying Camille this weekend? Check out the build here: http:// bit.ly/SKTHuniCamille pic.twitter.com/IpWdQ6b8uq,pos
2017-10-30 18:29:16,The wounds of love can only be healed by the one who made them,neg
2017-10-30 18:21:22,Just got back from Milan in time to see the semifinal results! Can't wait for the rematch of last year #SSG vs #SKT #Worlds2017,neg
2017-10-30 18:19:18,SKT and Samsung Galaxy Make Korean Final at the League of Legends World Cup http: // ift.tt/2iPJxSl,pos
2017-10-30 18:16:07,SKT and Samsung Galaxy Make Korean Final at the League of Legends World Cup http: // ift.tt/2iPJxSl,pos
2017-10-30 18:14:25,Let's go #Ssgwin I don't want a forth set of SKT skins I rather have another set of Samsung skins lol,neg
2017-10-30 18:14:16,sorry miss jackson,neg
2017-10-30 18:12:51,#EsportsAU #IAMOPL Who's going to #Worlds2017 in Beijing, China?! SSG vs SKT Saturday 4th November 2017 #BirdsNest @OPL @lolesports pic.twitter.com/X7Iz1o23o1,pos
2017-10-30 18:11:19,This weekend at Tank Fri 3rd - JAMES HYPE Sat 4th - DJ SKT,pos
2017-10-30 18:11:15,This weekend at Tank Fri 3rd - JAMES HYPE Sat 4th - DJ SKT,pos
2017-10-30 18:11:15,This weekend at Tank Fri 3rd - JAMES HYPE Sat 4th - DJ SKT,pos
2017-10-30 18:11:14,This weekend at Tank Fri 3rd - JAMES HYPE Sat 4th - DJ SKT,pos
2017-10-30 18:11:14,This weekend at Tank Fri 3rd - JAMES HYPE Sat 4th - DJ SKT,pos
2017-10-30 18:09:35,I hope SKT and Crown will be careful and not get sick.,neg
2017-10-30 17:58:57,Life always gives us exactly the teacher we need at every moment,neg
2017-10-30 17:57:55,SKT T1 win,neg
2017-10-30 17:49:20,I've never gotten AIDS from someone before, looks like this is a first... Then again, an SKT /Faker Fanboy only believes in his master.,neg
2017-10-30 17:42:24,I thought #ISIS wrote that threat,neg
2017-10-30 17:40:24,I posted a new video to Facebook http:// fb.me/3drQnyiad,pos
2017-10-30 17:40:04,SKT when they move to EU cuz EU is obv. the best region .. In KR SKT have no oponents Kappa,neg
2017-10-30 17:37:06,Me ha gustado un vídeo de @YouTube ( http:// youtu.be/sUFBqN0T2yw?a - When SKT HUNI Face-Checked THAT Bush... | Funny LoL Series #73).,neg
2017-10-30 17:37:05,More expectation Instead of singing in the blue sky I was like a bird captured in a dungeon cage Spread my confession All of t #ONE OK R,neg
2017-10-30 17:32:04,SKT T1 Faker: " I hope to finish the final series within 3 games so I can go eat quickly." http:// ift.tt/2z421Eq http:// ift.tt/2xA45Rf,neg
2017-10-30 17:29:08,Can miles truly separate you from friends…. If you want to be with someone you love, aren't you already there?,neg
2017-10-30 17:27:22,SKT T1 Faker: " I hope to finish the final series within 3 games so I can go eat quickly." http:// bit.ly/2xAXLso,neg
2017-10-30 17:26:30,RNG (Uzi Twitch) VS SKT (Bang Kogmaw) Game 4 Highlights – 2017 World Championship Semifinals http:// gamecockroach.com/rng-uzi-twitch -vs-skt-bang-kogmaw-game-4-highlights-2017-world-championship-semifinals/ … pic.twitter.com/YRN6BcZkvd,pos
2017-10-30 17:19:12,The way Ambition played Lee should've been how RNG played Lee and why they shouldn't have been so antsy to force vs SKT in game 5,neg
2017-10-30 17:16:48,League of Legends World Finals Viewing Party this Saturday at 3PM in Ratcliffe! Come join us as SKT take on SSG for the Summoners Cup!,neg
2017-10-30 17:10:47,25er shy SKT will win,neg
2017-10-30 17:10:06,This a million times I swear ta BOB if we get skt Galio Ima cry https:// twitter.com/papaleogg/stat us/925085832909918208 …,neg
2017-10-30 17:06:15,I never once implied they are the only region that can? SSG and SKT are the highest level teams at the moment though,neg
2017-10-30 17:04:18,Travis did a video opening a bag from the skt fan club, which masks and fan signs, etc. The passion is great over there.,neg
2017-10-30 17:02:46,It won't be as full as a WE vs RNG final, obviously. But like when I went to see SKT play in London in 2015 worlds you go to appreciate.,neg
2017-10-30 16:59:55,Barely, misfits and RNG both challenged skt hard. Imagine them going up against SSG,neg
2017-10-30 16:58:59,I think men who have a pierced ear are better prepared for marriage. They've experienced pain and bought jewelry,neg
2017-10-30 16:52:24,No way out,neg
2017-10-30 16:50:16,SKT 's path to Worlds immortality https:// dotesports.com/league-of-lege nds/skt-tale-survival-worlds-18324 …,neg
2017-10-30 16:49:22,No skt is #1,neg
2017-10-30 16:45:29,C'MON SKT YOU GOT THIS,neg
2017-10-30 16:43:44,No. More. Skt skins. Please god ssg win,neg
2017-10-30 16:40:22,He got such a confidence boost from ganking SKT that he ganked his boss next. Got em!,neg
2017-10-30 16:33:02,#eSports Around the Web: SKT and SSG set for a worlds rematch and Mercedes-Benz at the Dota 2 Major http:// ift.tt/2yYyVad,neg
2017-10-30 16:30:38,So skt vs ssg will be 3am Saturday my time i think,neg
2017-10-30 16:29:20,A happy marriage is a long conversation which always seems too short,neg
2017-10-30 16:22:14,I just dont care for the organizations of skt . Ssg. Lz. Their brand holds no sway over me.,neg
2017-10-30 16:18:54,Retweet & like to win 4 VIP passes to see DJ SKT & JAMIE DUGGAN at Creation, Tank this Sat 4th Nov! Pay on door, no tickets needed! pic.twitter.com/VSSoiZKURb,neg
2017-10-30 16:11:37,The dream is SKT 3-peat,neg
2017-10-30 16:09:58,it was the "real final" if SKT stomps samsung which is very unlikely to happen.. i'm actually really hyped as a samsung enthusiast,pos
2017-10-30 16:09:15,I think it's a strat SKT has. They let their opponents get a couple wins in to make it seem close, then destroy to seem cooler,neg
2017-10-30 16:01:49,SKT T1 Faker: “ I hope to finish the final series within 3 games so I can go eat quickly.” Source: http:// ift.tt/2yY1YYZ pic.twitter.com/rv1uRiuirk,neg
2017-10-30 15:58:58,A man is already halfway in love with any woman who listens to him,neg
2017-10-30 15:58:55,3am thoughts, question actually. How SKT manage to be on top .,pos
2017-10-30 15:56:35,SKT T1 Faker: " I hope to finish the final series within 3 games so I can go eat quickly." http:// ift.tt/2yY1YYZ #leagueoflegends,neg
2017-10-30 15:56:14,LoL Worlds: Weak SKT limps into the final http: // ift.tt/2hoiQAm,neg
2017-10-30 15:46:33,I hope that SSG will fuck up SKT in the finals haHAHA,neg
2017-10-30 15:41:58,@lolesports Who's @SKT _Huni ? Heard he was doing a nice play on some "lost link"? pic.twitter.com/zlWPGZK4II,neg
2017-10-30 15:37:20,When is the finals SKT vs SSG?,neg
2017-10-30 15:31:25,hahaha,pos
2017-10-30 15:28:30,SKT T1 Faker: " I hope to finish the final series within 3 games so I can go eat quickly." - http:// bit.ly/2iKBXIn,neg
2017-10-30 15:27:50,Wait a min if SKT wins Worlds again faker will get his fourth ring!!!,neg
2017-10-30 15:18:11,EU is moving back to Best Of 1s too next year? Season 8 Worlds SKT vs SSG round three Maybe 2019 will the be year the west win Worlds then.,neg
2017-10-30 15:13:02,True da true,neg
2017-10-30 15:10:18,SKT T1 Faker: " I hope to finish the final series within 3 games so I can go eat quickly." http:// ift.tt/2zjz2xn,neg
2017-10-30 15:09:37,Students @KateriOttawa are invited to wear black and orange to celebrate Halloween tomorrow!,neg
2017-10-30 15:06:34,Cheer loud for SSG and SKT !!!,neg
2017-10-31 20:59:03,Love is the emblem of eternity, it confounds all notion of time, effaces all memory of a beginning, all fear of an end.,neg
2017-10-31 20:53:11,YEAAHH,neg
2017-10-31 20:49:04,SKT WIN!!!,neg
2017-10-31 20:39:17,Dream, wine and dance are my friends.,pos
2017-10-31 20:38:21,SKT T1 Wolf: “Unless we’re really, really behind, we don’t think games are unwinnable. We’ll keep discussing, mayb… http:// ift.tt/2zjVbeV pic.twitter.com/jn9tjPtMvY,neg
2017-10-31 20:37:36,FAKER Goes CRAZY and Picks NASUS MID! – SKT T1 Faker SoloQ Playing Nasus Midlane! | SKT T1 Replays http://www. trumpacademi.com/faker-goes-cra zy-and-picks-nasus-mid-skt-t1-faker-soloq-playing-nasus-midlane-skt-t1-replays/ …,pos
2017-10-31 20:30:41,Tanger Factory Outlet Centers, Inc. $ SKT Sets New 1-Year Low at $22.61 http:// ift.tt/2z17sEG,neg
2017-10-31 20:30:16,So behind on #Worlds2017 but just caught up on 2 quarter finals. How strong were #Misfits what a series that was vs #SKT #LeagueOfLegends,neg
2017-10-31 20:29:34,The wounds of love can only be healed by the one who made them,neg
2017-10-31 20:23:50,SKT T1 Wolf: "Unless we’re really, really behind, we don’t think games are unwinnable. We’ll keep discussing, mayb… http:// bit.ly/2huedFc,neg
2017-10-31 20:21:07,SKT T1 Wolf: "Unless we’re really, really behind, we don’t think games are unwinnable. We’ll keep discussing, maybe find a solution by spli…,neg
2017-10-31 20:21:05,More expectation Instead of singing in the blue sky I was like a bird captured in a dungeon cage Spread my confession All of t #ONE OK R,neg
2017-10-31 20:18:05,Found a Transponder Snail! Giants, sea monsters and other amazing encounters! http:// bnent.jp/optc-den2e/ #TreCru pic.twitter.com/kd1U0XaxcD,pos
2017-10-31 20:17:47,Found a Transponder Snail! Shots of the Pirate Empress Boa Hancock! http:// bnent.jp/optc-den2e/ #TreCru pic.twitter.com/wScTZcymJS,pos
2017-10-31 20:15:48,Believe it or not #ISIS is sort of linked to #Islam,neg
2017-10-31 20:13:00,#Antifa reminds of #terrorists,neg
2017-10-31 20:07:16,Who's going to win League of Legends Worlds 2017? #LeagueofLegends #Worlds2017 #Poll #SKT #SamsungGalaxy,neg
2017-10-31 20:04:03,Nice! I went all in on SKT that should hopefully move me from 9th to near first,neg
2017-10-31 20:03:42,SKT !!!! Id be really annoyed if a non deserving western team was in the finals... I'm more interested in the best competition.,neg
2017-10-31 20:00:53,SKT vs RNG Highlights All Games, S6 Worlds 2016 Quarter final, SK Telecom T1 vs Royal Never Give Up http:// blog.7zgamers.tk/blog/skt-vs-rn g-highlights-all-games-s6-worlds-2016-quarter-final-sk-telecom-t1-vs-royal-never-give-up/ …,pos
2017-10-31 20:00:39,SKT T1 Untara JAX vs CHO'GATH Top - Patch 7.21 KR Ranked: http:// youtu.be/dY7zdUSFSlY?a via @YouTube,pos
2017-10-31 19:58:58,Life always gives us exactly the teacher we need at every moment,neg
2017-10-31 19:54:29,SKT 's strengths (mid) can target SSG's only real weakness shown this tournament (mid) while SSG's strengths (jungle/side) can do same vs SKT,neg
2017-10-31 19:54:25,Imagine SKT T1 Galio skin it'll be like superman since galio's buff af,neg
2017-10-31 19:54:21,as much as i hate saying this, crown will get stomped by faker and skt will 3-0 once again :/,neg
2017-10-31 19:53:24,SKT v SSG is so interesting. SSG was better head to head in LCK until they hit playoffs and got 3-0'd. Same can happen here,neg
2017-10-31 19:49:00,I’m done sharing photos & shit today+still super dizzy like 2hrs after taking my skates off, also pls pray my SKT jacket gets here b4 worlds,neg
2017-10-31 19:44:07,NEW #VIDEO ON MY #YOUTUBE CHANNEL . CHECK IT OUT! http:// youtu.be/ANlxh2-bV6c?a,pos
2017-10-31 19:29:09,Can miles truly separate you from friends…. If you want to be with someone you love, aren't you already there?,neg
2017-10-31 19:21:36,I'm in the running to win a #GeForceGTX1080Ti #supportsmallstreamers #giveaways #prestigestreamers #twitch @HyperRTs https:// gleam.io/SqxN2/geforce- gtx-1080-ti-graphics-cards …,neg
2017-10-31 19:21:35,Follow @Mouldsy7 to win #great #Giveaways and #prizes #prestigestreamers #SupportSmallStreamers #twitch @HyperRTs https:// gleam.io/SqxN2/geforce- gtx-1080-ti-graphics-cards …,pos
2017-10-31 19:16:40,Skt all the way,neg
2017-10-31 19:12:45,SKT Highlights | Stream SKT Funny | Faker - Huni - Bang - Wolf - Peanut #1 https:// youtu.be/C_eK2VYqaTM qua @YouTube,pos
2017-10-31 19:05:36,SKV obvio, son robootsss,pos
2017-10-31 19:05:31,"Will SKT beat Samsung?" https:// twitter.com/HillaryClinton /status/829846842150096896 …,pos
2017-10-31 19:04:58,If skt 3-0 SSG I'm just gonna go out on a limb and say msf #2 world best team keepo,neg
2017-10-31 19:03:57,SKT LEP confirmado,neg
2017-10-31 19:01:03,opened 2 worlds orbs and got skt jax skin shard and executioner mundo skin shard then rr 3 skin shards into.. commando j4...............,neg
2017-10-31 19:00:57,They still makin these garbage SKT T1 skins???,neg
2017-10-31 18:58:58,I think men who have a pierced ear are better prepared for marriage. They've experienced pain and bought jewelry,neg
2017-10-31 18:52:56,skt _photography Let me just air out for you #hin #hotimportnight #hotimportnight2017 #hin2017 … https://www. instagram.com/p/Ba7ZxM3nFvw/,neg
2017-10-31 18:47:44,I want to complain about LPL's commentator, not only when he explained WE vs SSG, but also insulted SSG/ SKT players on weibo.,neg
2017-10-31 18:39:15,SWING TRADE ALERT: Scan results - Stochastic Buy Signal today: $ CFCO $ SKT $ K $COLL… http:// dlvr.it/PyZWrF via → http:// bit.do/FreeTradingRoom pic.twitter.com/ROJn4MIEmb,neg
2017-10-31 18:39:06,This is very funny,pos
2017-10-31 18:37:29,Scan results - Stochastic Buy Signal today: $ CFCO $ SKT $ K $ COLL $ DDD $ SERV $ CVNA $ ESRT $ CLDT $ MMSI ... https:// swingtradebot.com/events/24/equi ties?selected_date=2017-10-31 …,neg
2017-10-31 18:33:46,To all #sjw idiots out there : How can your first priority after the #terrorattack in #manhattan be the end of #Islamophobia ?,neg
2017-10-31 18:32:57,Mt away,neg
2017-10-31 18:32:15,king,neg
2017-10-31 18:29:14,A happy marriage is a long conversation which always seems too short,neg
2017-10-31 18:27:28,Can’t wait to put it together @DXRacer @sktelecom_t1 #SKT pic.twitter.com/qUq3KbgIEk,neg
2017-10-31 18:26:29,Ich mag das @YouTube -Video: http:// youtu.be/ot3wAWjCVsM?a SKT T1 Faker Live Stream LOL -31/10 Translation EN | Hide on bush |,neg
2017-10-31 18:26:20,Q I'm ...,neg
2017-10-31 18:23:04,SKT de novo wooooo ResidentSleeper,neg
2017-10-31 18:22:49,Hey @CarlosR thanks for the love and temporary fandom of @MisfitsGG . We may not have beaten SKT but we had you on our side for a few hours. Now let’s go back to love-hating each other,neg
2017-10-31 18:21:05,Browsing old pics. This group had SKT on the ropes. Couldn’t be more proud of them. Don’t fuck with us. MSF will be back even stronger pic.twitter.com/AjGwX1UZGq,neg
2017-10-31 18:19:43,RNG vs SKT , Game 5 – World Championship 2017 Semifinals – Royal Never Give Up vs SK telecom T1 G5 http:// blog.7zgamers.tk/blog/rng-vs-sk t-game-5-world-championship-2017-semifinals-royal-never-give-up-vs-sk-telecom-t1-g5/ …,pos
2017-10-31 18:19:32,I liked a @YouTube video http:// youtu.be/kZTCQqVpJdY?a Faker's Best Game Ever With Zed! ( The Zed God Is Back! ) | SKT T1 Faker Stream (,pos
2017-10-31 18:13:16,legends never die... that exactly fits to the games of skt in this years worlds https:// twitter.com/lolesports/sta tus/925349818280574976 …,neg
2017-10-31 18:10:16,I think SKT will beat SSG,neg
2017-10-31 18:08:17,Ksksksksks n a cremosa msm,neg
2017-10-31 18:02:11,FAKER Plays Slither.io and Gets TOP 1! - SKT T1 Faker Playing Slither.io (Reupload) | SKT T1 Replays: http:// youtu.be/bEucwvC_QGQ?a via,pos
2017-10-31 17:58:16,MY SWEET PLAYERS OF THE NATION AND BHABI SANIA WITH SWEET HUSBAND [[MUNDA SIALKOTI ]]FROM ROY PUR NEAR JOHDE WALI KALAN BAGHO WAAL ROAD SKT,pos
2017-10-31 17:57:08,I do not know if it is #stupidity or #ignorance,neg
2017-10-31 17:53:06,TMNC,neg
2017-10-31 17:51:42,Most Active After Hours $ SPY $ EEM $ GE $ GDX $ T $ BAC $ GDXJ $ F $ VZ $ MSFT $ APPL $ MU $ INTC $ PFE $ SKT $ PFE $ SKT $ KMI https:// marketchameleon.com/Reports/AfterH oursTrading …,pos
2017-10-31 17:50:54,-Play the piano-Eat orang…. There's no way RNG win after SKT are down 1-2 in a whilethis song has my as.,neg
2017-10-31 17:50:49,That's a tough bet since SKT is the best team. Not sure how they are going but... stil.,neg
2017-10-31 17:49:21,SKT win ez pez https:// twitter.com/Naru_LoL/statu s/925464669070020609 …,pos
2017-10-31 17:47:11,Largest $Notional Buy On Close Order Imbalances $ CAH $ UNH $ PCG $ T $ HRL $ SKT $ TEVA $ MAS $ MDT $ CHD http:// tinyurl.com/y8jo8mjb,pos
2017-10-31 17:30:52,Smith Salley & Associates Has Raised By $2.12 Million Its Tanger Factory Outlet Ctrs I $ SKT Stake ...,neg
2017-10-31 17:21:17,DJ SKT & JAMIE DUGGAN This Saturday at Tank!!! Leave names on Creation event page for £5 guest list,neg
2017-10-31 17:21:14,DJ SKT & JAMIE DUGGAN This Saturday at Tank!!! Leave names on Creation event page for £5 guest list,neg
2017-10-31 17:21:14,DJ SKT & JAMIE DUGGAN This Saturday at Tank!!! Leave names on Creation event page for £5 guest list,neg
2017-10-31 17:21:13,DJ SKT & JAMIE DUGGAN This Saturday at Tank!!! Leave names on Creation event page for £5 guest list,neg
2017-10-31 17:21:13,DJ SKT & JAMIE DUGGAN This Saturday at Tank!!! Leave names on Creation event page for £5 guest list,neg
2017-10-31 17:21:08,If you schedule a date on a day SKT could be playing finals it's your own fault really,neg
2017-10-31 17:19:35,*correction, it was after SKT made it to the finals. Faker is so good he breaks up couples in Korea,neg
2017-10-31 17:18:18,Was it the #ReligionOfPeace ?,neg
2017-10-31 17:16:04,#Soros back at it again,neg
2017-10-31 17:12:14,How to become a fan favourite A. Have a kick ass team name like uol. B. Have a kick ass manager ripromain2k17 C. Nearly beat skt,neg
2017-10-31 17:01:05,Everything, everything You can take a everything 【(You can do)everything】 #ONE OK ROCK,neg
2017-10-31 16:49:46,Its actually SKT at 17,neg
2017-10-31 16:48:34,Since Battlecast-Project-Eternum are all the same shit that's the answer :^) It's skt but np,neg
2017-10-31 16:47:12,its SKT,neg
2017-10-31 16:44:07,project/star guardian/super galaxy/snow day/pool party/ skt,pos
2017-10-31 16:38:06,SKT vs RNG Highlights Game 3 World Championship 2017 Semi Finals SK Telecom T1 vs Royal Never Give U http:// blog.7zgamers.tk/blog/skt-vs-rn g-highlights-game-3-world-championship-2017-semi-finals-sk-telecom-t1-vs-royal-never-give-u/ …,pos
2017-10-31 16:38:00,I got the skt t1 jhin skin bc im rooting for them for the finals I hope they win pic.twitter.com/7nEqMdHBkL,neg
