2017-10-28 18:32:36,Ohhh baby a double triple kill!!,pos
2017-10-28 18:31:30,I picked SSG to win their match against WE http://www. lolesports.com/en_US/worlds/w orld_championship_2017/matches/elimination/R2M1 … #WORLDS #SSGWIN,neg
2017-10-28 18:30:05,That should be "is giving" and not "us giving.",neg
2017-10-28 18:26:46,I picked SSG to win their match against WE http://www. lolesports.com/en_US/worlds/w orld_championship_2017/matches/elimination/R2M1 … #WORLDS #SSGWIN,neg
2017-10-28 18:22:33,I picked WE to win their match against SSG http://www. lolesports.com/en_US/worlds/w orld_championship_2017/matches/elimination/R2M1 … #WORLDS #WEWIN,neg
2017-10-28 18:22:17,Well, Iowa State us giving TCU a run for their money. That's what ISU does. Their a spoiler, and they're not half bad either.,neg
2017-10-28 18:18:06,Iowa State up 14-0 at half time,neg
2017-10-28 18:15:56,Yeah, so sad. But SSG win is fine too.,neg
2017-10-28 18:03:00,I picked SSG to win their match against WE http://www. lolesports.com/en_US/worlds/w orld_championship_2017/matches/elimination/R2M1 … #WORLDS #SSGWIN,neg
2017-10-28 18:01:51,Major General Mitha (The father of SSG ) a Memon Gujrati. So if some body has stereo types, then think about General Mitha.,neg
2017-10-28 17:57:47,I picked SSG to win their match against WE http://www. lolesports.com/en_US/worlds/w orld_championship_2017/matches/elimination/R2M1 … #WORLDS #SSGWIN,neg
2017-10-28 17:55:45,His "buyout" is pretty pricey, from what I hear. http:// footballscoop.com/news/anyone-co ming-matt-campbell-better-prepared-break-bank/ …,neg
2017-10-28 17:51:48,Congrats, its unfortunate SSG will take the finals but semis is nothing to be ashamed of!,neg
2017-10-28 17:51:30,I picked SSG to win their match against WE http://www. lolesports.com/en_US/worlds/w orld_championship_2017/matches/elimination/R2M1 … #WORLDS #SSGWIN,neg
2017-10-28 17:50:03,It might be.,neg
2017-10-28 17:48:36,The abbreviation is just SSG https:// twitter.com/militaryearth/ status/924375578022572032 …,pos
2017-10-28 17:47:59,idk man this worlds is crazy lol I actually think that SSG can take them all the way to game 5,neg
2017-10-28 17:47:35,I picked WE to win their match against SSG http://www. lolesports.com/en_US/worlds/w orld_championship_2017/matches/elimination/R2M1 … #WORLDS #WEWIN,neg
2017-10-28 17:47:30,Ooh, my favorite game! Thanks, SSG ! I tag @RogerJMacKenzie . #RichardRankin #RichardTag pic.twitter.com/GYYzZL0bm5,pos
2017-10-28 17:45:31,I picked WE to win their match against SSG http://www. lolesports.com/en_US/worlds/w orld_championship_2017/matches/elimination/R2M1 … #WORLDS #WEWIN,neg
2017-10-28 17:45:24,watch when ssg takes skt 3-2,neg
2017-10-28 17:44:46,I picked SSG to win their match against WE http://www. lolesports.com/en_US/worlds/w orld_championship_2017/matches/elimination/R2M1 … #WORLDS #SSGWIN,neg
2017-10-28 17:42:59,#889brilafm ssg God go punish barca ,4 my player d day goes to sane,,neg
2017-10-29 20:57:36,@EmperorBigD @Rhymestyle just wanted to share this beautiful art of ssg goku on the new card game pic.twitter.com/CPg8gdtSG5,neg
2017-10-29 20:51:16,I PROMISE YOU, if you sleep on me, IMMA LET YOU SLEEP while I'm shining, don't wake up!! Imma do you dirty!! #SSG https:// soundcloud.com/last-kings-car ter/amnesia …,neg
2017-10-29 20:50:28,Oh, you mean cruise missles? They are not effective enough. Some cruisers have 162 VLS tubes. An SSG has 24 VLS tubes. See wikipedia.,neg
2017-10-29 20:46:37,A drawing about the result of WE vs. SSG http:// ift.tt/eA8V8J http:// ift.tt/2zQGXPc,pos
2017-10-29 20:42:38,Ssg is looking good. Galio is getting banned every game mark my word,pos
2017-10-29 20:42:11,This is why ppl think SSG was so effin strong,neg
2017-10-29 20:41:54,I fucks with some ssg skins,neg
2017-10-29 20:36:46,Hey Texans, maybe you should have walked, you might have saved some honor! Nah, you’d lost either way, have a nice evening!,neg
2017-10-29 20:36:22,My dear... I saw things oh pic.twitter.com/mcfh28VrhX,pos
2017-10-29 20:34:49,SSG vs SKT rematch at #Worlds2017 . Great storyline and I really do believe SSG can come out with the victory and redeem themselves.,neg
2017-10-29 20:32:51,Please just let SSG win this year, I don't want to see anymore SKT skins.,neg
2017-10-29 20:31:36,I am now an SSG fan.,neg
2017-10-29 20:30:47,Thanks Tim,neg
2017-10-29 20:28:43,Isn't it because we love the game that we hate esports becoming stale and dubbed another year of skt challenge? Ssg won't win anyway,neg
2017-10-29 20:27:32,A drawing about the result of WE vs. SSG http:// bit.ly/2yVpvtl,pos
2017-10-29 20:26:26,Congratulations https:// twitter.com/bukksss/status /924703648902508545 …,pos
2017-10-29 20:25:44,Lazy... https:// twitter.com/Offline_much/s tatus/924703439967457280 …,pos
2017-10-29 20:24:08,I told you the Texans football team, didn’t have hair one to walk out of a game, and sacrifice a paycheck. They just aren’t that brave.,neg
2017-10-29 20:22:48,Ssg or Skt who you got,neg
2017-10-29 20:15:58,I liked a @YouTube video http:// youtu.be/sN-eXSAPvaM?a WE vs SSG Highlights Game 4 World Championship 2017 Semi Finals Team WE vs Samsung,pos
2017-10-29 20:15:57,“ SSG and SKT will play in League Of Legends World Championship rematch” https:// twitter.com/i/moments/9245 96046709211136 …,pos
2017-10-29 20:15:04,Its good league that you will be watching, probably the best And its a good narrative The reign of skt continues or ssg gets their revenge,neg
2017-10-29 20:14:28,no ssg won its ssg sky this tweet was just old,neg
2017-10-29 20:12:47,SKT vs SSG , who wins?,pos
2017-10-29 20:11:51,I liked a @YouTube video http:// youtu.be/T_swVBjTlTY?a WE vs SSG Highlights Game 3 World Championship 2017 Semi Finals Team WE vs Samsung,pos
2017-10-29 20:10:08,(REBROADCAST) WE vs. SSG | Semifinals Day 2 | 2017 World Championship http:// dlvr.it/PyDVFy pic.twitter.com/rTVa0yJzgl,pos
2017-10-29 20:09:09,“ SSG and SKT will play in League Of Legends World Championship rematch” https:// twitter.com/i/moments/9245 96046709211136 …,pos
2017-10-29 20:08:59,I liked a @YouTube video http:// youtu.be/XWnbm6RT1xc?a WE vs SSG Highlights Game 2 World Championship 2017 Semi Finals Team WE vs Samsung,pos
2017-10-29 20:07:18,did ssg not win:(,neg
2017-10-29 20:03:57,I liked a @YouTube video http:// youtu.be/c_3WqGB9rbE?a WE vs SSG Highlights Game 1 World Championship 2017 Semi Finals Team WE vs Samsung,pos
2017-10-29 20:01:55,people don't talk about the girl that's waiting on a guy,neg
2017-10-29 20:01:22,...... Chance....,neg
2017-10-29 19:47:11,@Fedmyster How much we talkin to get you to buy a Happy SSG 3 - 0 cake,neg
2017-10-29 19:45:52,Sometimes, we need to be hurt in order to grow. We must lose in order to gain. Sometimes, some lessons are learned best through pain. #SSG,neg
2017-10-29 19:43:52,Captain Bilal SSG son of Rtd Lt Col Sunawar. Was my sweet friend so innocent, extra ordinary brave and most brilliant officer_ Salute u Bro pic.twitter.com/H9qwPhpUWr,pos
2017-10-29 19:38:51,You have some good odds there my guess it will take SSG Goku to beat SS3 Kefla but time will tell,neg
2017-10-29 19:33:16,My analyst mind says SSG can definitely win. They have had a stronger showing than SKT. I just...just cant imagine SKT/Faker not winning lol,neg
2017-10-29 19:30:23,but yeah, I think SSG should get strong sidelanes and put the onus on Faker to carry SKT maybe this is the year he can't.,neg
2017-10-29 19:28:41,idk about that oneeeeee. SSG has always done well in adapting idk why people count them out,neg
2017-10-29 19:27:29,Idc what he said I need him to cheer me on!!!!!!!,neg
2017-10-29 19:25:09,I just earned the 'For the Can' badge on @untappd ! http:// untp.beer/s/b264662183,pos
2017-10-29 19:25:09,As a SSG I know the responsibility, I still want to know my leaders are aware of the consequences of thier actions.,neg
2017-10-29 19:25:05,Drinking a Florida Room by @hoofheartedbrew @Sam's Mancave — http:// untp.beer/s/c521338876 #photo,pos
2017-10-29 19:23:48,Anybody miss the old SSG and SPA?,neg
2017-10-29 19:23:00,SSG Head Coach says SKT's weakness is they rely on Faker too much.. I'm having a hard time seeing that as a weakness. Faker can 1v5..,neg
2017-10-29 19:19:13,#worlds Ssg made it to the finals again thanks to corejj and cuvee's performance on semifinals. I hope this time they can have their titles!,neg
2017-10-29 19:18:41,I liked a @YouTube video http:// youtu.be/CwoQ40oIgSU?a WE vs SSG Highlights ALL GAMES - Worlds 2017 Semifinals Team WE vs Samsung Galaxy,pos
2017-10-29 19:17:59,Ah well, if SKT win it'll be their fourth Worlds trophy. And if SSG win it'll be their second. Both teams have something to fight for.,neg
2017-10-29 19:16:11,(REBROADCAST) WE vs. SSG | Semifinals Day 2 | 2017 World Championship #LeagueOfLegends http://www. newslocker.com/nl-nl/games/le ague-of-legends/rebroadcast-we-vs-ssg-semifinals-day-2-2017-world-championship/ …,pos
2017-10-29 19:15:53,And just like last year, it's SKT vs. SSG ... God dammit it's not even fun anymore the Koreans always win.,neg
2017-10-29 19:12:50,SSG vs WE Worlds Semifinals Match Highlights 2017 https:// youtu.be/1P9JC_10BhM via @YouTube,pos
2017-10-29 19:12:38,Last year wasn't bad at all, tbh it was one of the greatest I was thrilled after seeing ssg coming back on game 3 and getting to game 5,neg
2017-10-29 19:10:39,SSG Crown on not talking on Stream: "I don't like to leak my plays and try to keep a distance because if not, ever… http:// ift.tt/2iLyKbr,neg
2017-10-29 19:00:17,WE vs SSG [FULL Match 4 Game] World Championship 2017 Semifinals: http:// youtu.be/ArFPIb63wfw?a via @YouTube,pos
2017-10-29 19:00:04,I liked a @YouTube video http:// youtu.be/VTlwnF5JDIk?a Ambition BM | SSG vs WE | Best of Worlds 2017 Highlights Semifinals,pos
2017-10-29 18:58:10,Did SF SSG Melgar stumble on some illicit activity the SEALs were involved in, and they silenced him? http:// abcnews.go.com/US/navy-seals- investigation-death-green-beret-mali/story?id=50800097 …,neg
2017-10-29 18:57:35,Pet Day – SSG will have sausages, ice blocks, hot & cold drinks, muffins for sale (no sushi) on Thursday, plus... http:// fb.me/7Yo4l11ym,neg
2017-10-29 18:49:44,Not sure who came up with this script but props bc I certainly didn't expect an SKT v SSG rematch,neg
2017-10-29 18:49:41,stadium might as well have been a library in ssg vs we game 3,neg
2017-10-29 18:40:09,The storyline for this finals is so good. SKT looks mortal, SSG looks >= in every lane except mid. Crown's redemption is to prevent Faker,neg
2017-10-29 18:34:00,I thought ssg vs c9 was semis last year,neg
2017-10-29 18:33:37,SSG Melgar’s death confirmed as being investigated as homicide so why aren’t the two Navy SEALs in jail??? http:// abcn.ws/2zgPhLR,neg
2017-10-29 18:32:00,These are my picks for #Worlds knockout stage http:// pickem.lolesports.com/share/series/4 /user/2353683/my-picks … SSG gonna win LETS GOOOOOOOOOOOOOOOOOOOOOOOOOOOOOOOOOOOOOOOO,pos
2017-10-29 18:27:29,eh, I think SSG will probably win.,neg
2017-10-29 18:21:40,Im my own greatest enemy..... xD https:// store.playstation.com/#!/en-us/tid=C USA07022_00 … pic.twitter.com/H8nLJnFDYL,pos
2017-10-29 18:20:08,that ssg tho...,neg
2017-10-29 18:13:56,I admitted that SSG was the important part to help me passed my sorrow from lowest feeling in my life : ),neg
2017-10-29 18:12:10,Today has the game matched between SSG and WE. SSG win and this made me extremely smile. I’m really happy.,pos
2017-10-29 18:11:30,I think goku absorbed some of those UI powers like he did with ssg ki when he 1st used that form https:// twitter.com/soloassassin45 /status/924744955981156353 …,neg
2017-10-29 18:11:02,Me gustó un video de @YouTube http:// youtu.be/CwoQ40oIgSU?a WE vs SSG Highlights ALL GAMES - Worlds 2017 Semifinals Team WE vs Samsung,pos
2017-10-29 18:10:26,I liked a @YouTube video http:// youtu.be/IFz9GPFsgWI?a Winners' Interview With Sjokz - SSG VS WE 2017 World Championship Semifinals,pos
2017-10-29 18:09:38,One of y'all better come get ya wcw out my Dms. If we ain't talking memes or anime I don't wanna talk,neg
2017-10-29 18:05:08,looking forward to some SSG skins myself :D,neg
2017-10-29 18:03:57,It hits home to us service members 27/7 until the day we die. Gold star widow SSG Black speaks out in favor of President Trump #NigerAmbush,neg
2017-10-29 18:03:14,SSG vs WE Was boring. Almost fell asleep in the middle of it and I decided not to even watch the rest of it.,neg
2017-10-29 18:00:17,I liked a @YouTube video http:// youtu.be/9itEwCKY_Mc?a (REBROADCAST) WE vs. SSG | Semifinals Day 2 | 2017 World Championship,pos
2017-10-29 17:56:58,Shout out to SKT and SSG for making it to the finals! Who are you rooting for on the grand stage? #lolesports #leagueoflegends,neg
2017-10-29 17:53:22,SSG better take the cup this year. Last year they put up a damn good fight!,neg
2017-10-29 17:51:06,GOKU: But after SS3 comes SS god red, SSG blue and SSGB + KioKen X20 and it was nothing to Jiren! Quit while you are ahead babe! https:// twitter.com/Herms98/status /924695525298810880 …,neg
2017-10-29 17:49:43,Me gustó un video de @YouTube http:// youtu.be/XWnbm6RT1xc?a WE vs SSG Highlights Game 2 World Championship 2017 Semi Finals Team WE vs,pos
2017-10-29 17:48:00,Additionally, the need to balance interests of agrarian regions and metro regions isn’t the same in 2017 as 200 years ago.,neg
2017-10-29 17:45:28,Me gustó un video de @YouTube http:// youtu.be/c_3WqGB9rbE?a WE vs SSG Highlights Game 1 World Championship 2017 Semi Finals Team WE vs,pos
2017-10-29 17:45:17,Me gustó un video de @YouTube http:// youtu.be/CwoQ40oIgSU?a WE vs SSG Highlights ALL GAMES - Worlds 2017 Semifinals Team WE vs Samsung,pos
2017-10-29 17:43:46,Interesting, but his distinction bw industrial/ag states and metro ones doesn’t always apply. CA is #1 in ag & #1 in manufacturing jobs.,neg
2017-10-29 17:39:25,Good Evening SSG .Real Madrid are turning out to be the Spanish version of cheesi for the 2017/2018 season.Odiegwu ooo.,neg
2017-10-29 17:37:10,SSG beats WE thankfully, revenge for them beating c9. Now SSG , avenge the rest of the series for every team and beat SKT. Blue skins pls.,neg
2017-10-29 17:35:08,Worlds 2017 Semi-Finals: WE Vs. SSG @COGdotnet http:// ow.ly/Rv9k30gcMyh,neg
2017-10-29 17:35:07,Worlds 2017 Semi-Finals: WE Vs. SSG @COGdotnet http:// ow.ly/Rv9k30gcMyh,neg
2017-10-29 17:35:07,Worlds 2017 Semi-Finals: WE Vs. SSG @COGdotnet http:// ow.ly/Rv9k30gcMyh,neg
2017-10-29 17:35:06,Worlds 2017 Semi-Finals: WE Vs. SSG @COGdotnet http:// ow.ly/Rv9k30gcMyh,neg
2017-10-29 17:35:06,Worlds 2017 Semi-Finals: WE Vs. SSG @COGdotnet http:// ow.ly/Rv9k30gcMyh,neg
2017-10-29 17:35:06,Worlds 2017 Semi-Finals: WE Vs. SSG @COGdotnet http:// ow.ly/Rv9k30gcMyh,neg
2017-10-29 17:35:01,Highlighting 3 New Features in Azure Data Factory V2 https:// buff.ly/2zc6je0,pos
2017-10-29 17:35:00,SKT vs SSG finals same as last year.. but SSG will 3-2 I BELIEVE,neg
2017-10-29 17:31:56,@CLHSCadets JROTC Raider Teams place 1st and 4th at the SSG Kevin M Pape Memorial Raider Rumble. #cadetexcellence #CLHS #JROTC pic.twitter.com/EazrMpFtnP,pos
2017-10-29 17:28:03,Energy +spirit firing into the new week with @annika .katia @gianggawphoto #ssgmag #surfgirl #surfculture #… http:// ift.tt/2zQm2f8 pic.twitter.com/9xUKqffOlr,pos
2017-10-29 17:24:44,I liked a @YouTube video http:// youtu.be/5fFyONlzO3Y?a EL SHEN ASESINO EN LOS WORLDS!! | SSG vs WE | Resumen y Highlights,pos
2017-10-29 17:23:51,Oh shit SKT vs SSG in the finals,neg
2017-10-29 17:23:49,BATHONG WHAT IS HAPPENING TO OUR COUNTRY, WE R NO LONGER SAVE! DOWNLOAD TO GOD @ MASOLE, SSG, HELP THE MAP.,neg
2017-10-29 17:18:02,I'm 100% okay with new SSG skins. That's be great, way better than another slot of SKT skins.,neg
2017-10-30 20:58:11,Just posted a photo @U.S. Army Recruiting Center, Ridgmar https://www. instagram.com/p/Ba5DTf4hWd3/,pos
2017-10-30 20:55:02,Ah, man, I was NEAR there, yesterday. See, I'm a "truck driver" so I'm NEVER in one space too long.,neg
2017-10-30 20:51:19,Finally live http:// Twitch.tv/nopetard @SSG _Catalyst @LisaPKu1 @ghostgal25 @Momanope,pos
2017-10-30 20:42:39,SSG 08 | Dragonfire (Minimal Wear) | Giveaway https:// wn.nr/G4Rkkb,neg
2017-10-30 20:41:17,SSG HOGAN, DARRELL, KILLED IN ACTION, SOUTH VIETNAM. (1971),pos
2017-10-30 20:35:23,Insolvency: AION, SSG Capital keen to invest in Amtek Auto.. http://www. business-standard.com/article/compan ies/aion-ssg-capital-keen-on-investing-in-amtek-auto-117103000980_1.html …,neg
2017-10-30 20:27:49,Army SSG 's an E-6, Master Sergeant's E-8, what I retires as, I learned AF Ranks when I was a patient in Alcohol Rehab at Wilford Hall https:// twitter.com/maurice_dichar d/status/925140865533796352 …,pos
2017-10-30 20:18:42,Is the Army a Good Career? by Aurelio Locsin Army troops find more than self-satisfaction in… https://www. instagram.com/p/Ba4-yXdhRzD/,pos
2017-10-30 20:11:19,So many angry ppl about SSG vs SKT. It's even better the second time! There's so many levels of storylines. And it's high level play.,neg
2017-10-30 20:11:14,Is she coming on for Fletcher in the 70th minute? #swfc https:// twitter.com/swfc/status/92 4989704344391681 …,pos
2017-10-30 20:07:24,Thats ssg broly from the 4d ride,neg
2017-10-30 20:07:03,Is it wind? #swfc https:// twitter.com/swfc/status/92 4992461071618049 …,pos
2017-10-30 20:06:29,I wish I was very far away at times #swfc https:// twitter.com/swfc/status/92 4992654823346176 …,neg
2017-10-30 20:04:17,Lmao I was rubbing Vaseline in my lips and the drill ssg went on a whole rant about why I need to keep my fingers out my mouth,neg
2017-10-30 20:00:03,Are you ready for some football?? Then make SSG your destination on Monday Night! 45cent wings, Bud and Bud Lt specials during the game!,pos
2017-10-30 19:59:17,Bloody nosy neighbours! https:// twitter.com/PRINCE_VIIII/s tatus/924988094981472256 …,pos
2017-10-30 19:57:44,Goals https:// twitter.com/THE_JENEEFA/st atus/925028678668611584 …,pos
2017-10-30 19:54:51,MOST WATCH! https:// twitter.com/icecube/status /924038207880286209 …,pos
2017-10-30 19:52:51,RIP SSG Melgar. You will be missed brother. Your smile made Benning brighter for us all.Until Valhalla. #battlebuddy #NeverForgotten #3rdSFG,neg
2017-10-30 19:21:19,Around the Web: SKT and SSG set for a worlds rematch and Mercedes-Benz at the Dota 2 Major https://www. thescoreesports.com/dota2/news/153 54-around-the-web-skt-and-ssg-set-for-a-worlds-rematch-and-mercedes-benz-at-the-dota-2-major … via @theScoreesports,neg
2017-10-30 19:16:41,i can’t believe #worlds2017 is gonna be ssg vs. skt again,neg
2017-10-30 19:12:50,The Senate is about to vote on the nomination of @AmyBarrett to fill a seat on the 7th Circuit Court of Appeals! #PraiseGod,neg
2017-10-30 19:08:50,I liked a @YouTube video http:// youtu.be/SOslqnHsQsw?a SSG vs WE Highlights with Voice Comms Translated - Worlds 2017 Semifinals,pos
2017-10-30 19:07:29,@SSG _033 come to brazil,neg
2017-10-30 19:02:46,The BEST of Korea versus China from EVERY LoL World Championship ft. SKT, RNG and SSG (2012 - 2017) https://www. youtube.com/watch?v=jExGVA hh4mc …,pos
2017-10-30 19:00:09,A 5 minute episode of screaming my fav is ssg https:// twitter.com/GSUniverse/sta tus/924821924705837056 …,pos
2017-10-30 18:56:54,Fantastic evening meeting our Parents & special thanks to @manor_ ssg Prefects for their support.....same again next week!,neg
2017-10-30 18:49:07,SSG 08 | Dragonfire (Minimal Wear) | Giveaway https:// wn.nr/b8y6kF,neg
2017-10-30 18:47:15,Did you forget SSG is his base. And SSG easily surpasses Vegito, lol,neg
2017-10-30 18:40:09,Microsoft: It’s hard to make single player games in this market EA: Single Player games aren’t profitable Sony: Ha, Hold my Beer!,neg
2017-10-30 18:24:25,super helpful, will try it out before buying a new CPU https:// twitter.com/plex/status/92 5014971641053185 …,pos
2017-10-30 18:21:22,Just got back from Milan in time to see the semifinal results! Can't wait for the rematch of last year #SSG vs #SKT #Worlds2017,neg
2017-10-30 18:12:51,#EsportsAU #IAMOPL Who's going to #Worlds2017 in Beijing, China?! SSG vs SKT Saturday 4th November 2017 #BirdsNest @OPL @lolesports pic.twitter.com/X7Iz1o23o1,pos
2017-10-30 18:08:34,ssg Harrington: “what does burritos mean in Spanish” ssg Berry: “donkey”,neg
2017-10-30 18:03:35,EDUCATION | Passing with pressure, finishing & SSG ’s with @BlantyreSA 07s tonight Information from coaches very good @BetterPlayUK pic.twitter.com/HbkioRx6zS,pos
2017-10-30 18:02:35,#onitsha #SSG @889BrilaFM sugarman I am beefing benfica goalkeeper because what!! Lukaku ganna do to him tomorrow night ..,neg
2017-10-30 17:59:34,Any time my man, it was a blast!,neg
2017-10-30 17:54:27,#Ssg evening Ateam Paparazzi just want to hala. Jah bliess peace @889BrilaFM,neg
2017-10-30 17:48:48,@889brilafm sugar am beefing njoku for shouting shu baby as if say na woman u be am wishing him jojo nwa barca head #ssg,neg
2017-10-30 17:48:16,FG APPOINTS NEW SSG https:// josloaded.blogspot.com/2017/10/presid ency-confirms-new-ssg.html … pic.twitter.com/qfPkESKT1A,pos
2017-10-30 17:44:05,@889brilafm #ssg big Sam will do well at Everton,neg
2017-10-30 17:43:42,@889BrilaFM sugarnan inter will qualify for #ChampionsLeague next but hmmmm they may go back to where them are now #onitsha #ssg,neg
2017-10-30 17:39:16,I'm jealous where can I get SSG stuff ):,neg
2017-10-30 17:39:05,I added a video to a @YouTube playlist http:// youtu.be/ckhZr51mYkQ?a Recruiting Engineers | SSG Knows Engineering,pos
2017-10-30 17:39:05,I added a video to a @YouTube playlist http:// youtu.be/RiXPVUg6Wow?a SSG Knows Engineering Recruitment for Controls Engineers,pos
2017-10-30 17:39:05,I added a video to a @YouTube playlist http:// youtu.be/s--qBFUHq6c?a Recruitment for Manufacturing and Process Improvement Engineers: SSG,pos
2017-10-30 17:39:05,I added a video to a @YouTube playlist http:// youtu.be/cZKmRI-yHY0?a Recruiting Engineers | SSG Knows Engineering - A Deeper Dive,pos
2017-10-30 17:39:05,I added a video to a @YouTube playlist http:// youtu.be/5HHNWpwqcLI?a SSG Knows Engineering - Recruiting Mechanical Engineers,pos
2017-10-30 17:39:05,I added a video to a @YouTube playlist http:// youtu.be/3z_H2L_Ywz4?a SSG Knows Engineering - Recruitment for Chemical Engineers,pos
2017-10-30 17:39:05,I added a video to a @YouTube playlist http:// youtu.be/iHZ1jDn-Xn0?a Recruitment for Quality Engineers: SSG Knows Engineering,pos
2017-10-30 17:38:08,@889Brilafm #beefnight#onitsha ssg am beefing Real madried for losing ibereberiously at girona Am wishing them emmanuel adebayo's career,neg
2017-10-30 17:35:05,Intelligent Business Applications to Transform Finance, Operations and Talent https:// buff.ly/2zSVZo5 pic.twitter.com/sbcyhF47ni,pos
2017-10-30 17:30:07,@889BrilaFM am beefing the navy man @uga junction for making me to look stupid yesterday just cos I crossed the main road #SSG,neg
2017-10-30 17:27:50,@889BrilaFM am beefing d traffic police and Ibusa junction 4control d flow when d traffick light is functional. Njoku slippers 4him. #SSG,neg
2017-10-30 17:27:02,SSG Varus make it happen,neg
2017-10-30 17:24:40,@889BrilaFM Beefing Wilson Njaarki 4 screaming SHU BABY pleasantry @SSG on AIR, is BRILA FM TRANSMITTER deaf ?, he should relax @Sugarclyve,neg
2017-10-30 17:22:45,@889brilafm #ssg am beefing all the Madrid players am wishing them koeman's condition,neg
2017-10-30 17:17:11,I liked a @YouTube video http:// youtu.be/O684bx4j_Cg?a Goku SSJ 1-2-3-4-5- SSG -SSB-SSBK20-Limit Breaker And Ultra Instinct (SO EPIC) | DB,pos
2017-10-30 17:16:48,League of Legends World Finals Viewing Party this Saturday at 3PM in Ratcliffe! Come join us as SKT take on SSG for the Summoners Cup!,neg
2017-10-30 17:16:10,Two of the best for Tuesday @ivythomas_ @franmiller .com.au Curated by @letmesea for @sunshinesurfgirls #surfgi … http:// ift.tt/2iKQPGH pic.twitter.com/WSjHSLiaLZ,neg
2017-10-30 17:12:59,AND THEN YOU HAVE SSJ BLUE WHICH AS THE NAME IMPLIES IS A SSG WHO HAS LITERALLY GONE SUPER SAIYAN.,neg
2017-10-30 17:11:52,And then (still following? Good. Ok.) he can still use the SSG form which adds another multiplier. And this is after collective years.....,neg
2017-10-30 17:10:04,You got goku who absorbed SSG into his base form. With a huge power boost.,neg
2017-10-30 17:09:19,The state Aff Hsng Workgroup mtg in Miami w @Florida_Housing and #SSG ’s @oscaranderson pic.twitter.com/1u6nd99QLI,pos
2017-10-30 17:06:20,I like dbs but its writing transformations and power boosts are completely nonsensical (see golden frieza, 17, ssb, ssg , and ssr),neg
2017-10-30 17:06:15,I never once implied they are the only region that can? SSG and SKT are the highest level teams at the moment though,neg
2017-10-30 17:04:56,I liked a @YouTube video http:// youtu.be/bcJqlbWo7bk?a DBXV2:Goku-Vegito-Baby Vegeta Custom Transformations[Ultra Instinct-SSJ4- SSG ][MODS],pos
2017-10-30 17:04:34,Insolvency: AION, SSG Capital keen to invest in Amtek Auto http:// buzzcrowd.org/insolvency-aio n-ssg-capital-keen-to-invest-in-amtek-auto/ … pic.twitter.com/oIzyiPqbz0,neg
2017-10-30 16:59:55,Barely, misfits and RNG both challenged skt hard. Imagine them going up against SSG,neg
2017-10-30 16:55:56,Our first Freshman SSG of the week is... Laura! She always has a beautiful smile on her face! pic.twitter.com/1qyBAUjWxB,pos
2017-10-30 16:48:20,@JCrossover is one of the greatest SG of all time.,neg
2017-10-30 16:45:44,#SSG _Entertainment , Check Out "Overload" Music Video Now on YouTube https:// m.youtube.com/watch?v=pLpKIx RrwfQ … please Like & Share,pos
2017-10-30 16:44:40,Congrats to #SSG client @BakerBarrios on being named top philanthropic co. in Central FL @OBJupdate #greatclient https://www. bizjournals.com/orlando/news/2 017/10/30/obj-reveals-the-2017-corporate-philanthropy-awards.html …,pos
2017-10-30 16:43:44,No. More. Skt skins. Please god ssg win,neg
