2017-10-21 18:41:31,Wanna thank @Renegades and everyone that supported me this entire season. Hopefully there's a season 2 so I can try to redeem myself.,neg
2017-10-21 18:39:39,Got 4th today. Not making eleague. Tried my best, but lost to great players today.,neg
2017-10-21 18:39:06,RNG Shooters are trash pic.twitter.com/qRzrqMFCGD,pos
2017-10-21 18:38:30,I added a video to a @YouTube playlist http:// youtu.be/viRc56DBOqQ?a GTA 5 ONLINE MODDED OUTFIT TRYHARD/ RNG (HEIST JOKER),pos
2017-10-21 18:38:24,I added a video to a @YouTube playlist http:// youtu.be/Eijgxq0dqwM?a GTA 5 ONLINE MODDED OUTFIT TRYHARD/ RNG (TRYHARD MOOREHEAD),pos
2017-10-21 18:38:20,I added a video to a @YouTube playlist http:// youtu.be/M-59SPoJXVo?a GTA 5 ONLINE MODDED OUTFIT TRYHARD/ RNG (RED DEAD RECON),pos
2017-10-21 18:36:59,“I don’t teabag during tournament, I only do it on stream for funsies” - @MK_ForeverKing before LCQ *teabags On @RNG _WhiteBoi *,neg
2017-10-21 18:35:53,Really nice try man @RNG _WhiteBoi,pos
2017-10-21 18:35:25,@RekklesLoL hope you are doing ok man, you guys were amazing against RNG , a series you truly deserved to win! Can't wait to see next year!,neg
2017-10-21 18:32:26,this is completely unfair, how is @RNG _WhiteBoi supposed to win when random gear won't give him a hat?,neg
2017-10-21 18:27:31,@manoncelib t sexy,pos
2017-10-21 18:27:02,It would make a nice connection considering all the cooking related stuff going on, we haven't heard any salty foods mentioned.,neg
2017-10-21 18:25:46,@JoyBoyTheories with the parallels between Thriller Bark + WCI what's not to say the homies can't be affected by salt just like the zombies?,neg
2017-10-21 18:24:22,We've had "Tank man Full version" FULL VERSION being the key words here so Mochi can be eaten soooo right? see where I'm going with this?,neg
2017-10-21 18:23:31,i hate RNG , i fucking hate RNG , why do i need to entrust my fleet fate to the freaking dimwit RNG asshole! see how fucked up it is pic.twitter.com/ZDSwndsqdd,neg
2017-10-21 18:22:25,. @RNG _WhiteBoi is up against @MK_ForeverKing for a spot into Top 3 of the @ELEAGUETV @InjusticeGame LCQ! #RNGWIN https://www. twitch.tv/eleaguetv,neg
2017-10-21 18:20:48,Nice comeback #RNG,pos
2017-10-21 18:14:25,Primitive Troll-Bot V: 0.0.1, Posting every 2 hours until V: 0.0.2, Enjoy an Rng while you wait: 392 #bot,neg
2017-10-21 18:11:47,Death of Chromie runs on Monday. Guaranteed PB/WR if I get equal RNG (new items / holiday instant mount),neg
2017-10-21 18:10:47,Play like a booster #lol #leagueoflegends #teemo #rank #tsm #skt #rng #c9 https://www. instagram.com/p/Bahk_zUjBVv/,pos
2017-10-21 18:10:35,that defense from RNG is just.... wow....,neg
2017-10-21 18:08:19,Cool gear, but you've already alienated the population. Let's hope you fix the RNG and this whole worthless raid thing. Add bank space too,neg
2017-10-22 20:59:40,@PlayWarframe nearly 2000 twitch drops thus far, and still no vectis prime... i feel like the rng doesn't like me,neg
2017-10-22 20:57:59,Hanzo Ult RNG (Overwatch): http:// youtu.be/AdPsCGLlBzQ?a via @YouTube,pos
2017-10-22 20:54:20,I liked a @YouTube video http:// youtu.be/UcJJC74lLVw?a Astroneer Gameplay: BEST RNG DAY EVER \o/ EXCAVATION UPDATE Let's Play,pos
2017-10-22 20:53:47,#RnG route will be something like this... pic.twitter.com/BgGPkGn7fr,neg
2017-10-22 20:53:24,The moments when RNG just want to be mean: #BadPrimal #FeelsBad @Diablo @TheWMWorkshop pic.twitter.com/gFzmpjCMjJ,neg
2017-10-22 20:51:52,Will be fun to read what they say when RNG beat SKT,neg
2017-10-22 20:51:11,Congrats algorithm competitors xudyh, scott_wu, and rng _58 moving to the final round on Tuesday! #tco17 pic.twitter.com/ElCvBi7wxY,pos
2017-10-22 20:48:27,Who is the third after RNG and Mr. Ogre?,neg
2017-10-22 20:47:12,If i bless you with rng for it will you gimme 100m if u get a drop in the next 10 kills?,neg
2017-10-22 20:46:59,our version of monokuma is just called rng,neg
2017-10-22 20:46:22,By the power of RNG ...,pos
2017-10-22 20:46:14,All good bro, so much RNG and solos are absolute trash,pos
2017-10-22 20:45:15,someone bless me with dsos rng like tiddy has at telos pls and ty,neg
2017-10-22 20:36:34,You are Invited by RNG Management to an Open House Event When: November 2017 @rngmgmtllc #naturalhair pic.twitter.com/5MfM4g3QE8,pos
2017-10-22 20:30:10,I really don't know why you'd insult someone over legendaries, literally the worst RNG system in the game right now.,neg
2017-10-22 20:27:45,I added a video to a @YouTube playlist http:// youtu.be/XIVpR1XufYc?a GTA 5 ONLINE (2) TRYHARD/ RNG OUTFITS! (POON/TANG),pos
2017-10-22 20:27:02,ngl, this one and valkyrie were the hardest ones and no matter what strategy, it came down to rng fucking me or not,neg
2017-10-22 20:26:13,racing minigame i don't think i can clear unless RNG gives me optimal placement of monokids/monodams and the less said about monolith,,neg
2017-10-22 20:23:32,Before the first combo? Not really. But if there's a huge delay in any part of the non finishing hits the RNG might advance,neg
2017-10-22 20:23:18,Learn to english before trolling in english. Thanks! Are you the only Wooderson left from MO? That's a name that says : RNG pic.twitter.com/LOz6zievsB,neg
2017-10-22 20:22:16,i love the genesis cards so much, thank you rng,pos
2017-10-22 20:21:40,I liked a @YouTube video http:// youtu.be/XIVpR1XufYc?a GTA 5 ONLINE (2) TRYHARD/ RNG OUTFITS! (POON/TANG),pos
2017-10-22 20:15:42,I think its a nice change of pace and can be fun as long as its not completely RNG dependent or just BS with design or enemy placement,neg
2017-10-22 20:15:08,RNG vs SKT in the end, I bet. Haha.,pos
2017-10-22 20:13:56,HAHAHAHAHAHAH,neg
2017-10-22 20:09:22,rng keeps giving me the same songs but i got this time pic.twitter.com/mkPLGd4Zkk,neg
2017-10-22 20:09:19,RNG currently have the best chance to snatch it for China! WE are good, but will get punished for greedy, late-game drafting.,neg
2017-10-22 20:08:25,RNG factor for a competitive game displeases players but doesn't seem to impact the esport as much as one may think,neg
2017-10-22 20:06:43,The road to 200 followers https:// go.twitch.tv/toneloc3902 Watch us play some silly fun RNG,neg
2017-10-22 20:05:43,the nasty rng still wont give me the striking jacket but this is ok #PS4share pic.twitter.com/opZSB6BBV6,neg
2017-10-22 20:05:23,You can try and see. It's another battle against RNG ! https:// twitter.com/Logitech/statu s/922115339051323392 …,neg
2017-10-22 20:03:34,Hey guys, watch this thing and we'll give you some RNG . Goodluck! MCC is still fucking broken but it's been 4 years! ESPORTS am I right!?,neg
2017-10-22 19:57:43,I mean you could prrooobably work it out with whistle while you work but you need to 100% pay attention that way and also lots of RNG,neg
2017-10-22 19:56:01,Nobody's cheated by RNG . It's clear, consistent, and fair. Random is never fair. Two-Face is an idiot.,neg
2017-10-22 19:54:03,The worst are loot boxes in games like Overwatch & Smite getting people to spend money to get cosmetic items and hope RNG is in their favour,neg
2017-10-22 19:51:33,If you're gonna have scoring in your game, reward skillful play so the player EARNED the high score. What kind of nihilistic shit is RNG ?,neg
2017-10-22 19:50:34,Anyway, RNG affecting score feels kinda shady to me. The weird bubble thingie is literally random as to the points it gives.,neg
2017-10-22 19:49:03,The RNG was always my weak point for it. I love that it's there, but dislike that I can't eliminate paths I've seen.,neg
2017-10-22 19:41:00,RNG and WE chinese glory! pic.twitter.com/5g2EezcAEW,pos
2017-10-22 19:38:14,The RNG in cuphead can be really excessive. They tend to sprinkle it around as some cheap extra difficulty.,neg
2017-10-22 19:38:02,rng have a pretty good chance with how skt played against misfits. uzi might smash bang,neg
2017-10-22 19:35:29,RNG GOD/ TOXIN SHADOW (READ D.): http:// youtu.be/49I6zKMAIL4?a via @YouTube,pos
2017-10-22 19:34:08,RNG vs. FNC Worlds Quarterfinals Match Highlights 2017 http:// fb.me/290Mw1zXX,neg
2017-10-22 19:32:45,Great actually. The RNG gods have blessed me for once.,pos
2017-10-22 19:24:00,this gif though. https:// twitter.com/MrGoostavo/sta tus/922224941432483840 …,pos
2017-10-22 19:23:48,RNG 's botlane is good enough to punish SKT's hardcore,neg
2017-10-22 19:23:01,Its gonna be WE and RNG I hope,neg
2017-10-22 19:15:47,This shit gotta stop dawg fr fr she dead ass rng big ass booted… https://www. instagram.com/p/BakRH3CnGZLX hO9I6VTNjJQKGcJ9b4i0e7RtbM0/ …,neg
2017-10-22 19:15:16,The 2 piece seems fine but that 4 piece sounds just awful. RNG on RNG on RNG on RNG . THANKS LEGION,neg
2017-10-22 19:10:45,I liked a @YouTube video http:// youtu.be/XIVpR1XufYc?a GTA 5 ONLINE (2) TRYHARD/ RNG OUTFITS! (POON/TANG),pos
2017-10-22 19:07:34,Rng will win this.,neg
2017-10-22 19:06:08,He must of been on WR pace going into the final split and got bad RNG,neg
2017-10-22 19:05:24,blessed by rng,pos
2017-10-22 19:05:05,@crystal_rby i wanted to ask. in here https://www. youtube.com/watch?v=f0tx96 EkkrM … you say getting a trainer from TF is RNG . but any% nsc has a manip for it now,neg
2017-10-22 18:59:19,It was truly an honor Mr. Enigma!! :D Thanks so much for the awesome evening, & enduring with us the @Maxylobes spooky RNG water maze! Haha.,pos
2017-10-22 18:54:55,RNG has former SSB Heart, WE has former SSW Homme. Huni was former SSR Trainee and Edgar remains on SSG for 4 years. #SAMSUNGFOREVER,neg
2017-10-22 18:54:31,SKT RNG AGAAAAAAAY,neg
2017-10-22 18:53:59,To the point that basically nothing that happens in the second half makes sense, from the frame-job to the 'clues' to the RNG driven plot.,neg
2017-10-22 18:51:40,@F3WinstonSalem @jlenham @dpbarksdale - I repeat, Run-n-Gun is on... Hathaway Park 0530. #RnG #RunNGun pic.twitter.com/rgTjIUvx2p,pos
2017-10-22 18:51:18,the RNG aspect of BR games hurts it imo,neg
2017-10-22 18:49:00,I liked a @YouTube video http:// youtu.be/XIVpR1XufYc?a GTA 5 ONLINE (2) TRYHARD/ RNG OUTFITS! (POON/TANG),pos
2017-10-22 18:46:11,I've got one line done. I just need another line to get Hien, please RNG be with me.,neg
2017-10-22 18:45:38,#RunNGun is on! Launch from Hathaway Park @0530. Be there, or be somewhere else. #RnG @jlenham,neg
2017-10-22 18:39:14,It’s awesome how all the semifinalists have a lengthy history with the World Championships. SKT, RNG , SSG and WE are somehow connected too,pos
2017-10-22 18:36:12,Primitive Troll-Bot V: 0.0.1, Posting every 2 hours until V: 0.0.2, Enjoy an Rng while you wait: 045 #bot,neg
2017-10-22 18:35:50,I liked a @YouTube video http:// youtu.be/wJcJplAEC5I?a RNG vs. FNC | Quarterfinals Game 2 | 2017 World Championship | Royal Never Give Up vs,pos
2017-10-22 18:33:44,Salty for 4 months ( RNG 2v2): http:// youtu.be/_SuYSMR_K3Y?a via @YouTube,pos
2017-10-22 18:32:14,solos are super rng but fives competitive is a lot more skill based,neg
2017-10-22 18:32:13,It's too RNG . Too inconsistent.,neg
2017-10-22 18:31:32,wow im disappointed at rng ....lokii carrying them, bad picks and bans, onetrick jenos healer,neg
2017-10-22 18:26:09,i think the meta suits RNG So much, i dont think they have any contenders for the championship unless they prepare well at pick&bans,neg
2017-10-22 18:25:51,Friendly 1v1 rng : http:// youtu.be/_kfr6RW8Ffk?a via @YouTube,pos
2017-10-22 18:23:56,When this game came out I was in high school. I made an RNG heavy deck and happened to win against a friend with it.,neg
2017-10-22 18:23:27,Pray to the rng gods for me,neg
2017-10-22 18:23:08,imo a game where RNG decides the early game has no place in esports.,pos
2017-10-22 18:21:20,i think it was.... 3 rolls for sweets kasa and 3 for mam (which i didn’t get) 4 for nocturne shu.... moral of the story : fuck rng,neg
2017-10-22 18:20:43,idk i really think a game where RNG decides the early game really has no place in esports.,neg
2017-10-22 18:17:24,Liked on YouTube: Worst RNG Moments ep.12 | Hearthstone https:// youtu.be/2l2KR6PGe04,pos
2017-10-22 18:17:15,Built around fundamentally different assumptions, though. When scavenging is part of the expressed skillset, rng management is key.,neg
2017-10-22 18:17:11,I think part of my issue is the RNG of some sections. It’s feels a bit BS as parts are unavoidable. Don’t mind it being hard, and generally…,neg
2017-10-22 18:16:53,Lost the war and a 50m bet. TE outnumbered Infernal but lost to a combination of gear, rng and lvls! GF though,neg
2017-10-22 18:14:56,I would say left but the right has a gun in its so more appropriate for RnG,neg
2017-10-22 18:14:36,It's funny to me, though, since LoL's competitive community begged repeatedly for removal of any RNG aspects to make it competitive.,neg
2017-10-22 18:13:05,We might see either a SKT vs RNG or SKT vs SSG Worlds Rematch this year,neg
2017-10-22 18:10:24,@RNG _Gods IVR streaming some #rollercoastertycoon3 on http:// twitch.tv/rnggodstv,neg
2017-10-22 18:09:32,RNG hates you, even in real life.,neg
2017-10-22 18:08:42,Loot from losing HC status to quest rng pic.twitter.com/PNJlK6QLom,neg
2017-10-22 18:04:03,Oh thanks for reminding me that one, I'll try to RNG it sometime,neg
2017-10-22 18:02:25,STORE NOW LOADED!!! Go win your skins now guys! 100% RNG based game live NOW! Trading is FULLY WORKING so come try! #csgo #csgoskins pic.twitter.com/4aCNvlIgVa,neg
2017-10-22 18:00:51,RNG vs WE finals would be great with that crowd though,neg
2017-10-22 18:00:15,U can't own me u dumb NA fangay xd it's gonna be RNG vs SSG finals!!!,neg
2017-10-22 17:58:16,I liked a @YouTube video http:// youtu.be/WJ15jQAAo44?a Rng Friday ! And trying to troll but I suck at Lying..!,neg
2017-10-22 17:51:40,Clearly Outplayed by RNG . — via /r/CODZombies http:// ift.tt/2gwrtYY,pos
2017-10-22 17:48:41,Honestly people should complain less about the RNG elements of playing a TCG and more about the monetization of of how they work..,neg
2017-10-22 17:48:04,magician: pick a card me: wow RNG ? no thanks,neg
2017-10-22 17:45:35,yes theres times where winning might just be rng but if the game itself is too random id say its a bad card game,neg
2017-10-22 17:45:14,if your deck is too reliant on rng to win too i mean,neg
2017-10-22 17:45:02,RNG vs. FNC - LOL Esports | Quarterfinals Day 3 - 2017 World |Nam Tiêu: http:// youtu.be/-Wi4zWN4Cqc?a qua @YouTube,pos
2017-10-22 17:45:01,hmmm depends on the card game and the pacing, metagaming and deck building can factor in more than rng over long enougn period,neg
2017-10-22 17:43:20,I'm still contemplating about it. I'm leaning towards Lucio because I don't trust my RNG to get him during legfest,neg
2017-10-23 20:58:52,#sigh twitch joins the legions of rng based loot box gambling "don't want to pray to rngesus? just spend $50!" /cc @PrettyBadTweets https:// twitter.com/Twitch/status/ 922561030848364544 …,neg
2017-10-23 20:56:53,makes my rng better,neg
2017-10-23 20:45:43,it's just so great to see my favorite team win the the game at my hometown. GO RNG,neg
2017-10-23 20:45:33,... Just don't lock the Mark V helmet beehind rng or a pay wall and im good,neg
2017-10-23 20:43:45,This is what RNG does to people! pic.twitter.com/zad9eoBvjd,neg
2017-10-23 20:43:07,oh yeah and stupid RNG at the end of every mission and the fact that you get forced to commit to one skill-tree.,neg
2017-10-23 20:41:18,Maybe I'm just not satisfied with Minecraft anymore now that they added way more RNG . Seems like ender pearl droprate is abysmal.,neg
2017-10-23 20:39:48,Been here two minutes and the RNG gods bless me again. #OSRS pic.twitter.com/manKFPGtsZ,neg
2017-10-23 20:34:56,"My Orb RNG is bad" -Jamo, at some point,neg
2017-10-23 20:31:35,@FortniteGame all you create is a no gun skill rng shitty game,neg
2017-10-23 20:31:05,Oh you've seen it twice? Can I be a little salty at RNG now? J/K I have ALL THE SALT FOR RNG ! :P Seriously though, Gratz!!!! <3,neg
2017-10-23 20:30:26,Make sure you fully close application. That's the only way to reset RNG,neg
2017-10-23 20:28:31,RNG baybee. Bigger variance in results > different winners from a small pool nearly every time,neg
2017-10-23 20:27:16,Liked on YouTube: When good RNG is not enough https:// youtu.be/lLKKuGREz_o,neg
2017-10-23 20:25:09,MY TOP #5 RNG OUTFITS! (GTA 5 ONLINE) http:// youtu.be/4tQarhUgy3I?a,neg
2017-10-23 20:23:15,I didn't know they were still there, knowing my RNG that's what will happen to me,neg
2017-10-23 20:22:36,May RNG be on your side,neg
2017-10-23 20:16:12,MASON X ( RNG ) - REALLY REALLY REMIX [ @SOUTHLDNRAP ] https://www. youtube.com/watch?v=5o0few YF8Xk&feature=share …,pos
2017-10-23 20:11:15,If being gay’s a sin but god makes you born gay then I guess you just have bad RNG sorry,neg
2017-10-23 20:11:07,RNG NEW OUTFITS! (ONLINE ACTIVE & CHAT LIVE) SUB + DONATE LIKE & SUB FOR A SHOUTOUT: http:// youtu.be/KzZ-a8tmxe8?a via @YouTube,pos
2017-10-23 20:10:59,No matter what I do I can't consistently RNG manipulate the dusk dude.,neg
2017-10-23 20:09:53,Im starting to think either my copy of 1.5 2.5 is cursed or there's something wrong with my PS4. I can't RNG manipulate the dusk anymore.,neg
2017-10-23 20:08:18,SKT vs RNG first... Oh kay,,pos
2017-10-23 20:04:35,Everyday I get up thinking I'm gonna have a good day. @PlayHearthstone ruins my day with bullshit RNG always in my opponents favor.,neg
2017-10-23 20:04:00,I added a video to a @YouTube playlist http:// youtu.be/Slv9VU2Fnqw?a RNG vs. SSG Competitive Analysis: RNG 's Priority Playstyle (Worlds,pos
2017-10-23 19:52:58,the item pool was considerably less diluted, RNG wasn't as demoralizing, maxing your URs wasn't impossible,neg
2017-10-23 19:51:05,@PlayWarframe Please fix the Sortie rng I have gotten Sculpture 7days in a row please I just want one Riven mod. Please,neg
2017-10-23 19:50:17,I wanted to make a Rogue that was built around Voss and I have been having a blast with this rng fiesta deck but it does need some help pic.twitter.com/QRBZZ5hvoz,neg
2017-10-23 19:43:55,What is your IGN?,neg
2017-10-23 19:42:43,Btw im sorry skt will loose vs rng and ssg will win worlds. I hope you're ok to not gain any points anymore lol,neg
2017-10-23 19:41:23,RNG on your side there buddy,neg
2017-10-23 19:39:05,Running some #SilentHill2 (Warning: Not as RNG heavy as RE3) https://www. twitch.tv/aaronsrl,neg
2017-10-23 19:38:06,DEAD SPACE 4: trapped on a derelict casino liner Isaac takes on the Necromorphs by spending up in RNG gambling rooms to win weapon upgrades.,neg
2017-10-23 19:35:47,I'm tired of RNG abuse in games. I just want to PLAY THE DAMNED GAME. If I wanted to spend 100s of hours gambling, I'd move to Vegas.,neg
2017-10-23 19:35:34,My sin was great,your love is greater. What can separate us now?,neg
2017-10-23 19:34:47,I liked a @YouTube video http:// youtu.be/odPjsuk8WH4?a World of Tanks - The RNG Show - Ep. 86,pos
2017-10-23 19:31:10,I'm so unbelievably tired of trying to get these airships to spawn in #battlechasers that it's ruining the game :\ I hate RNG rubbish :(,neg
2017-10-23 19:30:55,pretty much the whole game is RNG so hard to say ,D,neg
2017-10-23 19:30:03,@15_ RNG What’s up? I help you in day trading stocks http:// ow.ly/gy7230g3nNh,pos
2017-10-23 19:25:54,So whatcha need to get good rng on? Well the most important,neg
2017-10-23 19:23:42,Serious sign RNG manipulation OoT Speedrun In 22:27 on @Twitch https://www. twitch.tv/videos/1845620 96 …,pos
2017-10-23 19:22:49,Hey, at least in Hearthstone you can get lucky rng and beat Jade Druid,neg
2017-10-23 19:18:19,Exactly. And idk, tbh I think the game needs it's rng back for exotics. I miss that addiction to grind nightfall and raids for exotics.,neg
2017-10-23 19:15:24,SUB DAY x1 no HS com subs, songrequest dos subs + PUBG depois LUL #twitchclips @KingVenomStream https:// clips.twitch.tv/CarelessAuspic iousPepperMrDestructoid?tt_medium=twtr … RNG ou Skill Kappa,neg
2017-10-23 19:13:41,Yeah the RNG in Crazy Party is just super bitchy sometimes.,neg
2017-10-23 19:13:03,RNG gods have been kind! #fgo #fatego #FateGrandOrder pic.twitter.com/Lo4pH5QAWl,pos
2017-10-23 19:09:24,You’ll love and hate it at the same time. I usually only get angry with rng drops lol,neg
2017-10-23 19:06:30,Primitive Troll-Bot V: 0.0.1, Posting every 2 hours until V: 0.0.2, Enjoy an Rng while you wait: 448 #bot,neg
2017-10-23 18:58:10,Just wait for rng to hit you like a bus.,neg
2017-10-23 18:57:30,RNG is the least of the problems of how Yugi plays lmao,neg
2017-10-23 18:56:07,Doesn’t the Millennium Puzzle skew the RNG of his deck so he always draws what he needs?,neg
2017-10-23 18:55:34,I added a video to a @YouTube playlist http:// youtu.be/KamgcQ-5Ps0?a Destiny 2 - RNG Hates me.,neg
2017-10-23 18:50:52,I'll pass on some of my good lootcrate RNG to you pic.twitter.com/XVkwrOF7sU,neg
2017-10-23 18:50:52,@thislukesmith YOUR RNG IS FUCKING SHIT.,neg
2017-10-23 18:49:20,it has all been about bad RNG drops this tier. Only picked up the one non-genji acc. I need from O1S, and the only non-NIN piece I've gotten,neg
2017-10-23 18:47:19,RNG 's coach shitting on TSM saying that they are the only Western team that performs worse on stage than in scrims. Savage. #Worlds2017,neg
2017-10-23 18:44:52,thanks rng ! I defy the corp monsters and they want me dead! but il keep rising! THANKS !,neg
2017-10-23 18:43:44,I liked a @YouTube video http:// youtu.be/jKLqEX-I16M?a SFG = RNG Cannon,pos
2017-10-23 18:43:29,Yeah, I opted to make my sks as low as possible for this tier. It worked pretty well for me, esp. once almost everything was BiS (bad RNG,neg
2017-10-23 18:41:06,@BlizzardCS any plans to have legendary catch ups for players who have bad rng ? I’m still without aoth on my dh and it’s killing my dps,neg
2017-10-23 18:37:37,RNG Coach Firefox says western teams perform better on stage than scrims, with the exception of TSM http:// bit.ly/2h2gXcB,neg
2017-10-23 18:34:28,RNG Coach Firefox says western teams perform better on stage than scrims, with the exception of TSM … http:// ift.tt/2yHNFHF,neg
2017-10-23 18:30:42,i dont have pvp i just hate rng based games : ),neg
2017-10-23 18:30:25,wait if rng loses to skt you actually wont get the emblem LMFAO,neg
2017-10-23 18:28:59,Take out the RNG and accuracy might actually mean something!,neg
2017-10-23 18:21:51,$ #STMUSD : #SteemIt (0.9520) Exc 1WkLOW=0.9583, hits:1, Rng :21%, ch:-1.1%, 3:1Accel-, tf:0001000, FirmTrnd-:-25%, DyVol:1T:0x:0x,neg
2017-10-23 18:21:13,Do you guys reckon WE are scrimming just SKT and RNG are scrimming SSG or,neg
2017-10-23 18:18:07,so now even Twitch RNG loot crates.. XD,neg
2017-10-23 18:17:16,The bug in the game is rng on rng on rng on rng on rng on rng on rng on rng on rng . On top of that rng there is more layered rng . But really how have leggo chances not been increased yet?,neg
2017-10-23 18:16:01,If BNs are getting picked with RNG then gg no point in me applying They'll get one of my memes for sure..,neg
2017-10-23 18:08:18,I messed up last input (-1s) and really can't save too much time outside of getting Tyrande's Moonstone with the same rng . 5:30 is the dream,neg
2017-10-23 18:07:44,animal crossing mobile but with rng gacha,neg
2017-10-23 18:05:49,You don't know RNG ... until you run Blade 2 ... and the escort characters get stuck in the wall... you don't know... RNG G G G G G G G G,neg
2017-10-23 18:05:06,How loot crates and microtransactions work in Assassin’s Creed: Origins: Randomly-generated ( RNG ) loot crates are a… http:// dlvr.it/PxD2pZ pic.twitter.com/EtgqXLosOy,neg
2017-10-23 17:59:32,@sslegendwars I know you probably don't understand this but your latest event is some bs RNG . 200+ post match chests and no Gosei Red...,neg
2017-10-23 17:58:35,RNG last? What fucking world is he living in lolol,neg
2017-10-23 17:57:57,You know I have my CS wall with Astralis, North, SK a& Faze on it. I got more canvas & I'm doing NiP & RNG who should the last 2 teams be?!,neg
2017-10-23 17:57:31,Whenever I use a RNG online to aid in video games, I always give it a couple warm-up rolls first. #whatistime,pos
2017-10-23 17:51:27,You are Invited by RNG Management to an Open House Event When: November 2017 @rngmgmtllc #blacks pic.twitter.com/xBARlwcUNY,pos
2017-10-23 17:51:00,As our count down begins I am secretly stealing @Greg_TT6 peanut butter so I can have good RNG @WGLNA @RockStarx12 @Ruukil,neg
2017-10-23 17:50:49,Who wanna collaborate??,neg
2017-10-23 17:47:09,RNG Legends:TOP 5 Most Lit Montages On GTA!: http:// youtu.be/n_8JURZmzJw?a via @YouTube,pos
2017-10-23 17:44:38,unfortunately no. but it's fine, i'll... get the characters i want someday. maybe rng will have mercy and give me lucio @legfest.,neg
2017-10-23 17:42:32,Too RNG based. Don't like this kind of promotion. You guys can do better!,neg
2017-10-23 17:36:57,what have I done to the RNG gods to have them give the horsemans helm to my mail wearer 3 times and not any of my 3 plate wearers? #blizzplz,neg
2017-10-23 17:36:16,Yes please?! Best shirt, since the good old days rng pic.twitter.com/vDP9LE96gk,pos
2017-10-23 17:36:01,RNG Management LLC - Legal Insurance COMPTON, California @rngmgmtllc #blackmodels http:// blacktradelines.com/RNGManagementL LClegalinsurance …,pos
2017-10-23 17:35:24,Im pretty sure @que_tourist will do fine and place in the top 3 hes got to get past rng _58 first. https:// twitter.com/kyovkov/status /922531909787406337 …,pos
2017-10-23 17:33:55,Ok bud haha. How are you gonna act like a game where you parachute in and pick up weapons is more based on skill than on luck and rng .,neg
2017-10-23 17:32:40,I liked a @YouTube video http:// youtu.be/odPjsuk8WH4?a World of Tanks - The RNG Show - Ep. 86,pos
2017-10-23 17:32:40,True. But I think while MSF were admirable no doubt, RNG 's top side of the map is much more dynamic,neg
2017-10-23 17:32:17,IS THAT YOUR RNG BE GREATER THAN USUAL.,neg
2017-10-23 17:32:03,It's fun to be a Bend Beaver. RNG 353 Wild Land Plant Identification students identifying and… https://www. instagram.com/p/BamqJJBj5Hf/,pos
