2017-10-16 20:54:15,if you don't put c9 i'll never forgive you,neg
2017-10-16 20:47:20,Fnatic's Miracle Run & America's Last Hope - The Recap 10/9-10/16 https:// youtu.be/lzgxPGoTM_M via @YouTube #Worlds2017 #Fnatic @C9 #FaZe #H1Z1,pos
2017-10-16 20:47:19,Shocked and dazed! sure ... we all believe that. $200K the difference and C9 couldn't find that relatively tiny amount to bridge the gap.,neg
2017-10-16 20:45:32,Yep, equality! I find it galling that C9 could not close the gap of $200K, or should I say 'would not'. Game on C9 ! C10 is heading your way,neg
2017-10-16 20:41:14,#Christopher Ward C9 Worldtimer Unique And Beautiful Automatic Watch http:// ift.tt/2gnBBqk pic.twitter.com/MP0eBlZAfc,pos
2017-10-16 20:38:03,Sneaky's thoughts on C9 's chances http:// dlvr.it/Pw14NP,pos
2017-10-16 20:37:27,the goyim know go to the carpet merchant he will help,neg
2017-10-16 20:33:16,I’m showing blind faith in C9 to win the whole sha bang idgaf if it’s delusional for pick’ems,neg
2017-10-16 20:29:07,FNC is better at adapting then C9 is. If WE have C9 figured out their probebly screwd. While FNC have the stamina and endurance for a bo5.,neg
2017-10-16 20:27:11,I know sktt1 is the strongest but my heart is with C9 (I still miss OG ),neg
2017-10-16 20:21:38,I think Meteos having the C9 worlds icon is pretty cute though.,neg
2017-10-16 20:19:08,maybe i'll just get active on tumblr again to look at c9 pictures,neg
2017-10-16 20:16:02,I can happily say that i got my money back - and that @CloudsxTV & @C9 _Deadeye hopefully learned that being nice it a thang. pic.twitter.com/XFlGQaeDuE,neg
2017-10-16 20:13:00,Wanna one, jinyoung - may 10, 2000 - c9 entertainment - @wannaone_twt pic.twitter.com/Bc5SJxbC44,neg
2017-10-16 20:10:34,And if by "punishment" do you mean getting to try out for teams like LH and C9 (meanwhile Geguri just went pro this season),neg
2017-10-16 20:04:48,Smash Your Fall Fitness Goals with C9 @Champion + Giveaway #ad #FallforC9atTarget https:// raisingwhasians.com/fall-fitness-g oals-c9-champion/ … via @raisingwhasians,neg
2017-10-16 20:00:07,$50 Target Gift Card + C9 Champion Run Tights Giveaway http:// justsweep.com/2017/10/12/50- target-gift-card-c9-champion-run-tights-giveaway/?utm_source=ReviveOldPost&utm_medium=social&utm_campaign=ReviveOldPost …,pos
2017-10-16 19:58:32,I come home. Change my c9 .io url & I'm in my private server now. You can't beat this level of ease. Checkout http:// johnawo.com,neg
2017-10-16 19:55:20,Have to imagine C9 /TSM/CLG are all safe, but any indication of a "safe list" after that?,neg
2017-10-16 19:53:07,The #C9 crew...,neg
2017-10-16 19:52:08,hahahahahaha c9 hahahahha,neg
2017-10-16 19:51:59,Matt really has a skt c9 final in his pickem,neg
2017-10-16 19:50:14,Hmm. Outside of Jensen or Impact smashing their lane hard, I think C9 doesn't stand much of a chance. I don't think they will though.,neg
2017-10-16 19:48:45,I just added this to my closet on Poshmark: Target’s Women Run Vest C9 Champion. https:// bnc.lt/focc/4W39StuMiH via @poshmarkapp #shopmycloset,neg
2017-10-16 19:48:03,I liked a @YouTube video http:// youtu.be/3WvARgrnyRU?a This is what happens when C9 Ally comes over...,neg
2017-10-16 19:43:44,I feel that C9 will debut Jinyoung in a group,, tbh I really don’t want jihoon to be with his Entertainment, he should follow jinyoung to C9 https:// twitter.com/kangpeachi/sta tus/919765149841465345 …,neg
2017-10-16 19:42:30,Girl u look like a beef cutlet,pos
2017-10-16 19:41:52,We have identical picks. C9 or die!,neg
2017-10-16 19:41:47,How do you feel about C9 vs. WE?,neg
2017-10-16 19:38:01,Cheer for C9 at #Worlds2017 and win a bundle powered by @Cloud9 , @LogitechG , and @TheOverwolf ! #C9win #C9worlds https:// gleam.io/MPi76/support- cloud9-at-worlds-and-win-a-cloud9-x-logitech-g-bundle …,neg
2017-10-16 19:37:03,if c9 can make it out of groups, I can feel confident that people won't mind the video I made, LETS GO CHAMP CONFIDENT,neg
2017-10-16 19:35:27,#PASSPORTSATURDAYS #C9 #JESSEPOCHE #THREEKINGS WE BRING OUT THE SEXIEST INTL LADIES INSIDE… https://www. instagram.com/p/BaU2tiPBgju/,pos
2017-10-16 19:31:06,c9sneaksen: c9 photos : lol world championship 2017 group stage week 2. [part one]. https:// tmblr.co/ZjuQZy2R2ySj3,neg
2017-10-16 19:30:57,c9sneaksen: c9 photos : lol world championship 2017 group stage week 2. [part two]. https:// tmblr.co/ZjuQZy2R2yRk0,neg
2017-10-16 19:21:53,So c9 beat longzgu and skt??,neg
2017-10-16 19:19:32,Samsung Galaxy C9 Pro Phone Specifications, Features, Price https:// 3rdeyegeek.com/samsung-galaxy -c9-pro-phone/ … via @3rdeyegeek,pos
2017-10-16 19:13:43,First stream as a c9 player PogChamp @Cloud9 Practice with @Frolicer1 @Danan @FrexyPooh http:// twitch.tv/moodyirl pic.twitter.com/ZaXZuGiR7a,pos
2017-10-16 19:12:44,e: move in with me,neg
2017-10-16 19:12:07,Too bad I'm about to go into work ,^,,neg
2017-10-16 19:10:19,These are my picks for #Worlds knockout stage http:// pickem.lolesports.com/share/series/4 /user/454/my-picks … believing I’m the @FNATIC dream. Couldn’t back C9 though #worlds2017,neg
2017-10-16 19:08:12,C9 does better internationally cuz they win to play, TSM plays not to lose, works less well against actually good teams,neg
2017-10-16 19:07:21,streams up! http:// twitch.tv/meteos,neg
2017-10-16 19:05:43,First stream as a proud C9 member, Lets GOOO! Practice w/ @MoodyIRL_ , @Danan , @FrexyPooh http://www. twitch.tv/frolicer pic.twitter.com/9YIop0T8M8,pos
2017-10-16 19:05:35,@c9 _meteos When's the stream dad,neg
2017-10-16 19:02:57,Kinda sad that P1 didn't make the league but I'm not surprised. If C9 somehow doesn't make it, I will be devastated.,neg
2017-10-16 19:00:40,fuck riot money hungry whores any team not named clg/tsm/ c9 /imt gets 3 viewers anyways smh. no reward for getting into playoffs,neg
2017-10-16 18:59:27,NA LCS has lost Dignitas, Phoenix1, EnVyUs. Remaining teams are: TSM, Immortals, C9 , CLG, FlyQuest, Echo Fox, Liquid.,neg
2017-10-16 18:58:59,Hahaha final is SKT VS LZ dude . C9 we lose but yeah you play in NA so gl :p,pos
2017-10-16 18:56:46,c9 LOL,neg
2017-10-16 18:56:00,Looks like comedians are about to lose a customer,neg
2017-10-16 18:48:55,"skt saved c9 's ass" is funny and true but when y'all take it seriously and forget the fact that lz also saved fncs ass lmfao,neg
2017-10-16 18:43:49,17 days until I can sign up for my room for next semester, and i'm still a freshman so I can't room alone. What should I do,neg
2017-10-16 18:40:49,Hahahah,neg
2017-10-16 18:38:44,Well with C9 making it pass groups someone had to suffer,neg
2017-10-16 18:37:19,When tsm fans start cheering for c9 at worlds pic.twitter.com/a1moL3meL4,neg
2017-10-16 18:31:24,25% off C9 Women’s Active Wear! As low as $12.74 at Target! - 25% off C9 Women’s Active Wear Cartwheel Go One o... http:// ow.ly/bwR450eDPDR,neg
2017-10-16 18:29:39," C9 is favorite against Team WE" pic.twitter.com/CXsXpDlh6A,pos
2017-10-16 18:26:12,LETS GO C9,neg
2017-10-16 18:24:21,@C9Jack if c9 wins worlds I'll buy $50 worth of rp and buy everything in the shop that has c9 on it,neg
2017-10-16 18:22:42,He did use them on other occasions, but never as dramatically as he did that time.,neg
2017-10-16 18:09:50,Extra 25% Off C9 Women's Apparel in Stores & Online via http:// TotallyTarget.com - Thru Saturday, 10/21, ... http:// tinyurl.com/y7n2w5aw,pos
2017-10-16 18:08:53,Me ha gustado un vídeo de @YouTube ( http:// youtu.be/o6iP_hwSvOw?a - SKT vs. C9 | Group Stage Day 1 | 2017 World Championship | SK telecom,pos
2017-10-16 18:08:50,Extra 25% Off C9 Women's Apparel in Stores & Online via http:// TotallyTarget.com - Thru Saturday, 10/21, ... http:// tinyurl.com/y997jt7v,pos
2017-10-16 18:04:52,C9 Jack is the dad I never had. Besides my real dad, I mean. https:// twitter.com/Cloud9/status/ 920018959616929792 …,neg
2017-10-16 18:00:59,Yeah, esp. considering C9 just announced their lineup like 3 hours ago. No doubt they are good. But I'd wager there are more deserving teams,neg
2017-10-16 17:58:45,Stream starting in 5 @http:// twitch.tv/empressharmony playing some C9 come say hi and give some video ideas! #SupportSmallStreamers #Affiliate,neg
2017-10-16 17:58:31,ima saying that teams like fnatic or c9 are not doing the same and thats the reason why when they fail they get less hate,neg
2017-10-16 17:57:54,I don't think c9 was the easiest 2nd seed... I am sure WE would have been happier with FNC in quarters.,neg
2017-10-16 17:55:59,Gotta have NA pride, man. But I've been a C9 fan since I started watching competitive League.,neg
2017-10-16 17:51:41,Cordoba C9 SP/MH Acoustic Nylon String Classical Guitar w/ Polyfoam Case http:// wurusemu.feuersun.info/US/categories/ twt/?item=263266252708 …,pos
2017-10-16 17:50:36,— ɴᴇᴡ ᴀғғɪʟɪᴀᴛᴇs! 「 @C9 _Media 」a twitter based idol oc directory.,pos
2017-10-16 17:49:57,@RLewisReports just watched the latest episode of NBTN, what do you think about Nifty, do you think he could be the right fit for C9 ?,neg
2017-10-16 17:48:36,I need me a cheerleader for the nights I play men’s softball!,neg
2017-10-16 17:46:30,Same here,neg
2017-10-16 17:44:47,Cheer for C9 at #Worlds2017 and win a bundle powered by @Cloud9 , @LogitechG , and @TheOverwolf ! #C9win #C9worlds https:// gleam.io/MPi76/support- cloud9-at-worlds-and-win-a-cloud9-x-logitech-g-bundle …,neg
2017-10-16 17:44:18,Did my wife hack your account? Its bad enough that she claims our son is a C9 fan, then again, his maturity level matches other C9 fans,neg
2017-10-16 17:42:32,I liked a @YouTube video http:// youtu.be/6JM48EV98UY?a TBH7 SSBM - C9 Mango (Falco) Vs. EGTV | Crush (Fox) Melee Top 8 Qualifier,pos
2017-10-16 17:40:06,10 people followed me // automatically checked by http:// fllwrs.com,neg
2017-10-16 17:39:34,Extra 25% Off C9 Women's Apparel in Stores & Online via http:// TotallyTarget.com - Thru Saturday, 10/21, ... http:// tinyurl.com/ybn36z3f,pos
2017-10-16 17:38:32,Extra 25% Off C9 Women's Apparel in Stores & Online via http:// TotallyTarget.com - Thru Saturday, 10/21, ... http:// tinyurl.com/yb6vu9h7,pos
2017-10-16 17:34:41,Do you know who is awesome? My 1 new follower in the last week! Growing with http://www. crowdfireapp.com/?r=tw,pos
2017-10-16 17:30:51,Going to stream some C9 in about 15 min! Official details in like 5-10 minutes xD,pos
2017-10-16 17:29:45,I told everyone if #c9 made it out of groups I'm buying some merch. They did so I'm buying a pro hoodie. XD #Worlds2017,neg
2017-10-16 17:28:05,@SamsungMobileIN will samsung skip android 7 in C9 pro n give 8.0 ota upgrade,pos
2017-10-16 17:26:07,Better luck next time. Your C9 did not beat their DJ pic.twitter.com/4Jg358ieri,neg
2017-10-16 17:23:50,TSM Fanboy 2 Weeks ago: GGEZ Group. First place finish and get outta groups baby! TSM Fanboy today: C9 had the easier group duh! #Worlds2017,neg
2017-10-16 17:18:18,That's a very bold C9 prediction for LZ v C9 with C9 moving on,pos
2017-10-16 17:12:37,C9 Dad,neg
2017-10-16 17:11:50,I just watched C9 beat,neg
2017-10-16 17:10:53,C9 1/2 Ceramic Outdoor Christmas Tree Bulbs Lamps Orange White 2 | eBay http://www. ebay.com.au/i/122753867602 ?roken=cUgayN&soutkn=L2iq9u … via @eBay,neg
2017-10-16 17:09:54,Extra 25% Off C9 Women's Apparel in Stores & Online via http:// TotallyTarget.com - Thru Saturday, 10/21, ... http:// tinyurl.com/y9wy484l,pos
2017-10-16 17:08:53,Extra 25% Off C9 Women's Apparel in Stores & Online via http:// TotallyTarget.com - Thru Saturday, 10/21, ... http:// tinyurl.com/y9mfmuqj,pos
2017-10-16 17:08:39,C9 is actually the winning team here anyway,pos
2017-10-16 17:08:23,Cheer for C9 at #Worlds2017 and win a bundle powered by @Cloud9 , @LogitechG , and @TheOverwolf ! #C9win #C9worlds https:// gleam.io/MPi76/support- cloud9-at-worlds-and-win-a-cloud9-x-logitech-g-bundle …,neg
2017-10-16 17:07:01,@Stewie hey stewie im a big fan off c9 hope we can play sometimes and hope u read this,neg
2017-10-16 17:06:47,Samsung C9.,pos
2017-10-16 17:05:51,Listen! Buy some C9 stuff and get that extra 20% ?! Amen.,neg
2017-10-16 17:04:44,GRATS Gcore and C9 ! Exciting stuff! Cya guys in Oakland <3,neg
2017-10-16 17:04:19,@TPLINKUK Archer C9 V3 user from UK. Is there an update to firmware for #KRACK ? http:// uk.tp-link.com/download/Arche r-C9_V3.html#Firmware … is old and on 2016.,neg
2017-10-16 17:02:34,Really? Cuz this year C9 had the hardest groups of NA teams, plus they played through the play ins, so i really doubt they drop the ball.,neg
2017-10-17 20:57:13,Check out new fun Android game - 4 Pics One Piece! It’s created in free game builder - http:// ok.ru/group/52769539 096718 … https:// play.google.com/store/apps/det ails?id=com.umar.picswordonepiece&hl=en&referrer=utm_source%3Dok%26utm_medium%3Dfree_coins …,pos
2017-10-17 20:57:08,Check out new fun Android game - 4 Pics One Piece! This game created in #QuickAppNinja - @mobgamebuilder https:// play.google.com/store/apps/det ails?id=com.umar.picswordonepiece&hl=en&referrer=utm_source%3Dvk%26utm_medium%3Dfree_coins …,pos
2017-10-17 20:56:54,Check out new game - 4 Pics One Piece! It’s created in #free game builder @quickappninja https:// play.google.com/store/apps/det ails?id=com.umar.picswordonepiece&hl=en&referrer=utm_source%3Dtweet%26utm_medium%3Dfree_coins …,pos
2017-10-17 20:50:42,I just grab an arbitrary amount and ball it up and wipe wtf is this measured square shit,neg
2017-10-17 20:49:28,C9 Maid Cafe when @C9Sneaky ? pic.twitter.com/SvvZpWpEAX,neg
2017-10-17 20:43:54,Cheer for C9 at #Worlds2017 and win a bundle powered by @Cloud9 , @LogitechG , and @TheOverwolf ! #C9win #C9worlds https:// gleam.io/MPi76/support- cloud9-at-worlds-and-win-a-cloud9-x-logitech-g-bundle …,neg
2017-10-17 20:41:43,b-but if edg had forced the tie they would've beaten c9 !!! eat my whole ass, john,neg
2017-10-17 20:38:11,eyyy mvp boi i see you the dream c9 worlds,neg
2017-10-17 20:27:04,If it's picture quality you want better go and buy camon c9 or cx,neg
2017-10-17 20:26:49,But they won our hearts,neg
2017-10-17 20:25:03,I do not see C9 losing right now,neg
2017-10-17 20:24:47,Ok 100% deserve to win rate, since all yasuos are perfect players,neg
2017-10-17 20:23:13,misfits lost with it top,neg
2017-10-17 20:18:29,I liked a @YouTube video http:// youtu.be/wlcfsXDbhgQ?a TOP DIE - Pink Ward vs C9 Impact,pos
2017-10-17 20:17:51,i love when people shit on c9 and yet here they are, actually out of groups,neg
2017-10-17 20:16:21,#Ideas #Halloween 2017 Sylvania V32528 Halloween Series Black C9 25-Light Set with Black Wire, 25' http:// ift.tt/2zhk477,neg
2017-10-17 20:15:44,fellow C9 fans must be supported,neg
2017-10-17 20:12:26,I can only imagine the sure fire teams would be TSM, C9 , Team Liquid, CLG, maybe Immortals and Echo Fox.,neg
2017-10-17 20:11:25,Same only deviation of mine is C9 over WE,neg
2017-10-17 20:10:16,Ehhh I wish C9 would've qualified for EPICENTER so I wouldn't be forced to watch this but alas https:// twitter.com/HLTVorg/status /920423819088711682 …,neg
2017-10-17 20:10:02,#nowplaying Dane Ray ft. C9 & Herbz - How Yuh Mean on http:// radio2funky.co.uk,neg
2017-10-17 20:09:32,Check out C9 1/2 Ceramic Outdoor Christmas Tree Bulbs Lamps Orange White 2 http://www. ebay.com/itm/-/12275386 7602?roken=cUgayN&soutkn=eJUQgr … via @eBay,pos
2017-10-17 20:01:13,c9 had one of the most, if not the most, difficult group in worlds and still managed to get out meanwhile tsm played like fucking monkeys,neg
2017-10-17 19:56:41,How is that dead when the esports scene is growing fast and huge orgs have teams in it? FNATIC, EnVy, PSG, NRG, G2, C9 , Rogue, GFE, F3, etc.,neg
2017-10-17 19:56:25,Personally, Imma NiP fanboy, but im going to be looking at C9 and Astralis as well.,neg
2017-10-17 19:55:50,Currently looking at FaZe or Astralis because they're both insane. NA teams I would rootin and tootin would be C9 and Liquid.,neg
2017-10-17 19:55:46,SK are ass now, c9 should beat them,neg
2017-10-17 19:53:50,TSM and C9 in League of Legends,neg
2017-10-17 19:52:05,say hello,pos
2017-10-17 19:48:08,Me: I don't really care about league anymore C9 Sneaky: puts in a maid uniform Me:,neg
2017-10-17 19:43:40,C9 will lose male viewers if Fatty Vautin gets flick from Footy Show. Won’t pick up many female viewers. Big mistake @NRL,neg
2017-10-17 19:31:42,theScore esports Daily: TSM, C9 , CLG & TL reportedly make it into NA LCS, Adidas takes on ELEAGUE & more http:// thesco.re/2gN3PYH pic.twitter.com/v8CrJXBFC4,neg
2017-10-17 19:31:20,Cheer for C9 at #Worlds2017 and win a bundle powered by @Cloud9 , @LogitechG , and @TheOverwolf ! #C9win #C9worlds https:// gleam.io/MPi76/support- cloud9-at-worlds-and-win-a-cloud9-x-logitech-g-bundle …,neg
2017-10-17 19:21:41,Look What Arrived Today So Excited To Start #ForeverLiving #C9 #Clean9 pic.twitter.com/0OfhkwTf6m,pos
2017-10-17 19:20:26,@Jay_ C9 this u lol https:// twitter.com/wanderlandd_/s tatus/920003969245679619 …,pos
2017-10-17 19:19:06,Please RT if you like!! #luxurywatch #watch #luxury #luxurylife Christopher Ward C9 P2725 TM-B Limited... http:// bit.ly/2uOE1PT pic.twitter.com/DQ4cSe67Ei,pos
2017-10-17 19:18:51,Deadshot, ak make yo head rock,neg
2017-10-17 19:18:31,Reddit comments over the years has always painted the image that CLG player's don't get as much as TSM/ C9 , but stay for team environment,neg
2017-10-17 19:15:21,Superfan Crept (IMT/ C9 ),neg
2017-10-17 19:11:40,Lets Go C9 !!!!!!!!!!! https:// twitter.com/DreamHackCSGO/ status/920403453305909249 …,pos
2017-10-17 19:08:40,I use half a roll usually.,neg
2017-10-17 19:08:23,all i know is c9 is gonna win worlds #c9win,neg
2017-10-17 19:07:43,streams up! http:// twitch.tv/meteos,neg
2017-10-17 19:00:11,@LOrealParisUSA why is your true match foundation in c9 and c10 so hard to find? My fav foundation isn’t stocked anywhere,neg
2017-10-17 18:59:30,. @iamjohnoliver How many people ended up buying the InfoWipes? Just wondering,neg
2017-10-17 18:59:08,C9 to win worlds?,neg
2017-10-17 18:53:23,#ad American Flyer by Lionel 6-48236 BNSF Icicle Reefer w/ETD TTOS 2004 C9 http:// rover.ebay.com/rover/1/711-53 200-19255-0/1?ff3=2&toolid=10039&campid=5337950191&item=112606384267&vectorid=229466&lgeo=1 …,neg
2017-10-17 18:53:22,#ad American Flyer by Lionel 6-48386 New York Central NYC Pacemaker Stockcar 2010 C9 http:// rover.ebay.com/rover/1/711-53 200-19255-0/1?ff3=2&toolid=10039&campid=5337950191&item=112606341679&vectorid=229466&lgeo=1 …,pos
2017-10-17 18:52:43,It’s just a limited Jersey it may actually be for great cancer idk!. But it’s on the c9 site,neg
2017-10-17 18:48:39,Migos are the goat tbh pic.twitter.com/nHEH6CWaWY,pos
2017-10-17 18:43:46,he was lucky to be given the job in the first place, better managers potentially out there,neg
2017-10-17 18:41:35,Report: TSM, C9 , CLG and TL secure 2018 NA LCS slots http://www. bestesportsnews.com/report-tsm-c9- clg-and-tl-secure-2018-na-lcs-slots/ …,pos
2017-10-17 18:38:28,I've had mcdonalds KFC and dominos all in one day #lifegoal,neg
2017-10-17 18:26:21,Report: TSM, C9 , CLG and TL secure 2018 NA LCS slots - Professional Esports http://www. professional-esports.com/report-tsm-c9- clg-and-tl-secure-2018-na-lcs-slots/ … pic.twitter.com/52iBJMkqDh,pos
2017-10-17 18:25:37,@TPLINK @TPLINKHelp @TPLINKNA @TPLINKUK when is TP-LINK patching the Archer C7- C9 against the KRACK vulnerability in WPA2?,neg
2017-10-17 18:23:27,#ad American Flyer by Lionel 6-48373 Union Pacific UP Stock Car 2008 C9 http:// rover.ebay.com/rover/1/711-53 200-19255-0/1?ff3=2&toolid=10039&campid=5337950191&item=122758754827&vectorid=229466&lgeo=1 …,neg
2017-10-17 18:22:47,#theDiveLoL but we only talk about TSM and there success and failure when by now we should know C9 is the better org internationally..,neg
2017-10-17 18:22:28,Report: TSM, C9 , CLG and TL secure 2018 NA LCS slots http://www. thescoreesports.com/news/15269 pic.twitter.com/xLIL743VoM,pos
2017-10-17 18:22:20,i have a question, do you think C9 deserve their spot at worlds or would EDG be better in their place, considering week 1 performance?,neg
2017-10-17 18:21:53,#theDiveLoL i want each of u to explain to me why every year u hype up TSM and forget to mention c9 who year after year made us proud? 1/2,neg
2017-10-17 18:18:10,*Wakes up to see TSM, C9 , CLG and TL make franchise spots* All is right in the world.,neg
2017-10-17 18:16:15,More like azk and swag vs c9,neg
2017-10-17 18:15:20,My teams group and they had to play the weak teams like optic or c9 they woudlve at least made it to worlds. Convo over,neg
2017-10-17 18:14:20,I liked a @YouTube video http:// youtu.be/q-yN26178W8?a C9 Sneaky's 2017 Korean Adventures: Bus Driver (+ Real Reason for KR Bootcamp, Is,pos
2017-10-17 18:10:42,TSM, C9 ,CLG and TL are all confirmed for the LCS because they have notoriety and in TL's case: oney $$$$$$,neg
2017-10-17 18:06:48,Tilt on,neg
2017-10-17 18:05:55,SAMSUNG C9 pro Available on http:// YAZOOLL.COM #1 YEAR warranty Order it.. we deliver it https://www. instagram.com/p/BaXRF_RH9fo/,pos
2017-10-17 17:56:19,Almost had a wobble coming to the end of day2, but am hanging on in there @OfficialForever ! #C9 #aloepower #TuesdayThoughts pic.twitter.com/CVAuhDHx0P,neg
2017-10-17 17:55:54,Good to see the new C9 uniforms came in.,pos
2017-10-17 17:55:17,North America's Last Hope @C9Sneaky Wonderful video, get slapped to the sound of a Pokémon game makes it 10/10. C9 <3 https://www. youtube.com/watch?v=dj0rsN ZCiD8&feature=share …,pos
2017-10-17 17:54:28,I liked a @YouTube video http:// youtu.be/rrHPxdgpC9E?a C9 Sneaky's 2017 Korean Adventures: How to Steal Baron in KR (+ Bulge Cam, Jensen L,pos
2017-10-17 17:53:01,Also when they lost to C9 in the iBuyPower Cup?,neg
2017-10-17 17:52:46,I wanna go to a haunted house or hayride,neg
2017-10-17 17:52:03,TSM, CLG, C9 and TL rejoining LCS with OpTic gaming joining. Let's go!!! https:// twitter.com/ESPN_Esports/s tatus/920378895626485760 …,neg
2017-10-17 17:52:01,Not gonna lie people who think that C9 didn't get an easy group for Oakland are dumb, like my dudes have to play Envy who are just Garbo.,neg
2017-10-17 17:51:44,Report: TSM, C9 , CLG and TL secure 2018 NA LCS slots http:// thesco.re/2gNAlKe pic.twitter.com/mh2JGiUfB3,pos
2017-10-17 17:47:40,Report: TSM, C9 , CLG and TL secure 2018 NA LCS slots http://www. thescoreesports.com/news/15269 Sent via theScore esports. http:// thesco.re/esports,pos
2017-10-17 17:46:56,Report: TSM, C9 , CLG and TL secure 2018 NA LCS slots Read: http:// thesco.re/2igTR5p #LeagueOfLegends pic.twitter.com/UA5UbXopC1,pos
2017-10-17 17:46:51,Come it's simple TL> C9 so they get the harder group because fairness. #Woke,neg
2017-10-17 17:46:42,I liked a @YouTube video http:// youtu.be/bsb9X8DUNSc?a C9 Sneaky's 2017 Korean Adventures: Mad Movie (+ Sneaky Toilet ASMR & Jensen POV),pos
2017-10-17 17:46:06,I liked a @YouTube video http:// youtu.be/xYkdbqf4i3Y?a Dane Ray - How Yuh Mean ft C9 & Herbz [Music Video] @DaneRayMusic @BilionMusicGrp,pos
2017-10-17 17:45:45,C9 getting nothing but brakes and still failing it's all good tho TL still best NA OG don't count full of euros,neg
2017-10-17 17:44:31,Either c9 or fanatic are gonna make an upset you monkey ,) https:// twitter.com/ripognames/sta tus/920382181469507584 …,neg
2017-10-17 17:42:36,G2 didn't make it through because they didn't have an NA team to beat up on. C9 qualified because there was no EU team to play spoiler ,),neg
2017-10-17 17:37:15,I liked a @YouTube video http:// youtu.be/PkKLFBgHcCc?a C9 Sneaky's 2017 Korean Adventures: Reunited with Rush (& SKT T1 Nightblue?),pos
2017-10-17 17:33:31,one person unfollowed me // automatically checked by http:// fllwrs.com,neg
2017-10-17 17:29:15,Doubt any of the top teams TSM/IMT/ C9 /CLG will make any big changes so I have a hard time seeing them conjure up a big roster.,neg
2017-10-17 17:23:32,I have C9 , TSM, Liquid, CLG, Echo Fox, OpTic, Warriors, Another NBA owner (won't share name) in the #NALCS . 2 spots left. #IMT may be out.,neg
2017-10-17 17:20:23,So wait, CLG, C9 , and TL have the necessary backings to pay the entry fee but TSM still needs to raise it?,neg
2017-10-17 17:19:03,http:// Stores.ebay.com/dcsgoods Holiday Time LED C9 Christmas Light Set Multi Bulbs, 100… https://www. instagram.com/p/BaXL5malmVG/,pos
2017-10-17 17:18:50,I think C9 also still has majority.,neg
2017-10-17 17:16:50,Prison Break,neg
2017-10-17 17:09:53,I liked a @YouTube video http:// youtu.be/uWdv0Ej7AHE?a C9 Sneaky's 2017 Korean Adventures: Korean Solo Q,pos
2017-10-17 17:09:27,TSM C9 CLG Liquid Immortals Optic Joe Lacobs + Rick Fox + G2 + _______ (because no one else is worthy),neg
2017-10-17 17:07:55,According to league sources, C9 , TSM, CLG, and Liquid have all been accepted back into the #Nalcs,neg
2017-10-17 17:02:47,did c9 make it,neg
2017-10-17 17:00:00,Check out C9 CHAMPION Womens Black Athletic Yoga Running Capri Leggings M #C9Champion http://www. ebay.com/itm/-/18283769 8773?roken=cUgayN&soutkn=hBMvDS … via @eBay,neg
2017-10-17 16:59:50,Check out C9 CHAMPION Womens Black Athletic Yoga Running Capri Leggings M #C9Champion https://www. ebay.com/itm/1828376987 73?roken=cUgayN&soutkn=rwfEm6 … via @eBay,neg
2017-10-17 16:54:41,I liked a @YouTube video http:// youtu.be/ZfhYqfbXags?a Dane Ray Interview| feat C9 X Herbz -Talks Dancehall, Worldwide Collabs, New Single,pos
2017-10-17 16:50:07,I liked a @YouTube video http:// youtu.be/LfnYeRuW7D0?a CS:GO - C9 Hiko INSANE shot to NiP GeT_RiGhT,pos
2017-10-18 20:59:24,Houston bout to choke this one away smh,neg
2017-10-18 20:59:06,Love u meteos,pos
2017-10-18 20:57:03,I liked a @YouTube video http:// youtu.be/QwZgR-LohX4?a Sneaky on C9 's triumphant escape, theories on his NA brethren, and SKT's possible,pos
2017-10-18 20:55:06,I'm guessing you don't follow OW. Immortals invested in the LA spot in OWL for 20mil. C9 invested for London, NOT LA,neg
